Datum;Titel;Text;Link;Quelle;Autor
01.11.2020;Algorithmen verraten: „Wie normal bin ich?;"Denn wie dessen Macher, der niederländische Künstler und Privatsphäre-Architekt Tijmen Schep, demonstriert, arbeiten Algorithmen zur Gesichtserkennung bzw. -beurteilung noch sehr unzuverlässig und lassen sich dementsprechend leicht überlisten. So kann zum Beispiel die Altersvorhersage manipuliert werden, indem man sein Gesicht auf und ab bewegt, der Attraktivitätswert kann steigen, wenn man das Licht anschaltet, und wenn man einen niedrigeren Body-Mass-Index erhalten möchte, genügt es, die Augenbrauen hochzuziehen. Verzerrte Wahrnehmung
Abgesehen davon, dass sie leicht zu manipulieren sind, werden auch die Vorurteile der Algorithmen aufgedeckt. Der Algorithmus zur Bewertung der Schönheit etwa wurde anhand von Fotos trainiert, die von Studenten in China bewertet wurden, wo gänzlich andere Schönheitsideale gelten als hierzulande. Andere Algorithmen basieren auf Fotos von Hollywood-Schauspielern, die sich beispielsweise über die Film-Website imdb.com abgreifen lassen, und liefern dementsprechend verzerrte Ergebnisse. Wie normal bin ich?
Wer wissen möchte, wie normal er/sie ist und wie es um die eigene Schönheit, Gewicht, Alter und Lebenserwartung bestellt ist, kann dies über die Website hownormalami.eu selbst herausfinden und diese Paramter allein anhand einer Aufnahme des eigenen Gesichts durch Algorithmen beurteilen lassen. Um die Privatsphäre zu schützen, wurden die KI-Modelle so modifiziert, dass sie im Browser laufen können. Die gesamte Analyse erfolge lokal auf dem eigenen PC (Webcam vorausgesetzt) bzw. Notebook oder Smartphone, es würden keine persönlichen Daten an die Cloud geschickt, betont Schep. Der Niederländer befürchtet, dass diese KI-Systeme in Zukunft immer häufiger dazu verwendet werden könnten, um uns in Relation zu anderen zu setzen und uns so auf lange Sicht dazu anregen könnten, so durchschnittlich wie möglich zu sein. Für die kulturelle Vielfalt und Individualismus würde dies das Aus bedeuten.";https://www.krone.at/2257812;Krone;
22.08.2020;So lauschen Alexa und ihre neugierigen Freundinnen;"Die meisten kennen „Alexa“ und „Siri“, „Google Assistant“, „Cortana“ (von Microsoft) oder „Bixby“ (von Samsung). Diese digitalen Assistentinnen sind praktisch und mit ihnen gelang die Realisierung eines völlig neuen Interfaces Mensch-Maschine. Wir müssen nicht mehr in eine Tastatur tippen, Befehle werden per Sprachsteuerung erteilt.

Gelauscht wird ständig
„Siri, spiele mir das Lied vom Tod!“, „Alexa - bestelle Sushi!“, „Google Assistant - wie ist der Verkehr auf meinem Weg zur Arbeit?“, „Cortana, sag mir, wie das Wetter wird!“, „Bixby - checke meinen Puls!“ Die smarten Lautsprecher-Mikrofon-Kombis sollen uns das Leben erleichtern, Alexa & Co. warten darauf, dass wir jenes Wort sagen, mit dem sie aktiv werden können. Sie hören folglich also immer zu, sie lauschen ständig. Früher Datenschutz-Horrorszenario, heute Alltag
Was vor einigen Jahren noch unvorstellbar war und als Daten- und Privatsphärenschutz-Horrorszenario schlechthin begriffen wurde, ist inzwischen für viele Menschen Alltag. Ein Gerät, das buchstäblich alles hören kann, was man sagt.

Das erinnert auffallend an George Orwells „Televisor“ in seinem Roman 1984. Ein TV-Überwachungsapparat, der zugleich Sende- und Empfangsgerät ist und in jedem Haus in Orwells Roman 1984 verbaut war, um die Bürger Ozeaniens überwachen und ihnen Anweisungen erteilen zu können.

Im Internet-of-Things-Zeitalter muss der Staat gar keinen Televisor mehr installieren, das haben die Bürger längst selbst getan, weil sie Geräte wie Smartphones nutzen. Oder digitale Assistenten, die ja offiziell nicht als Abhör- und Spyware, sondern als Lifestyle-Produkte verkauft werden. Sprachsteuerung macht uns kontrollierbar
Die Sprachsteuerung hat die Kommunikation Mensch-Maschine auf der einen Seite vereinfacht, uns aber auch kontrollierbarer gemacht. Denn die digitalen Sprachassistentinnen speichern Daten, die von anderen ausgelesen werden können - von Amazon, Apple oder Google sowieso, aber es mehren sich die Fälle, dass auch die Polizei Zugriffe auf diese Sprachaufzeichnungen haben will. Erst im Vorjahr forderte die US-Polizei im Mordfall Silvia Galva von Amazon die Herausgabe von Sprachaufzeichnungen, weil am Tatort ein Echo-Lautsprecher stand. Auch für Cyberkriminelle interessant
Alexa & Co. werden aber auch von Cyberkriminellen attackiert. Alexa verfügt über 50.000 Funktionalitäten, ist mit 20.000 Geräten kompatibel und wird von mehr als 3500 Marken verwendet. Logisch, dass dieser technologische Bereich auch für Cyberkriminelle interessant ist. Und sie können tatsächlich auch gehackt werden, mit so genannten „Audio-Injektionen“. Fünf Wissenschaftler der University of Electro-Communications in Tokio und der University of Michigan haben Sprachassistenten mittels Licht attackiert: Per Laser konnten sie Befehle in verschiedene sprachgesteuerte Geräte über große Entfernungen und durch Glasfenster quasi „injizieren“. Mit einem Laserstrahl, der auf das Mikrofon zeigt, wandelt das Mikrofon das elektrische Signal des Lichts in einen Befehl um. Das funktionierte auch aus einer Distanz von mehr als 100 Metern. Damit kann man jedes sprachgesteuerte Gerät, vom Tablet über den Lautsprecher bis hin zum intelligenten Türschloss manipulieren - das die Garage öffnet, in der der teure Wagen steht.

Die Sprachbefehle landen in der Cloud
Wie eine digitale Assistentin funktioniert, ist einfach erklärt. Über ein Mikrofon wird der Befehl in die Internet-Cloud geschickt, in der eine Software jedes gesprochene Wort analysiert und entsprechend dem Befehl/Wunsch reagiert wird. Alle gesprochenen Daten bleiben nicht nur bei Amazon & Co. gespeichert, sondern werden auch ausgewertet, damit die Systeme noch besser werden. Amazon setzt übrigens Qualitätsverbesserer ein - Menschen (im Home-Office) sichten das Material, also Sprachbefehle und Kommunikationen, um die Sprachtechnologie zu verbessern. Und dieser Bereich ist höchst lukrativ. Auch aus einem weiteren Grund: Die Betreiber dieser digitalen Assistenten können nämlich das Spracherkennungssystem mit dem Werbesystem kombinieren und die Sprachbefehle integrieren.

Offiziell wird dies nicht bestätigt, aber warum bekommt man, wenn man mit dem Smartphone am Tisch über ein Produkt redet, beim nächsten Mal surfen im Web plötzlich Werbung solcher Produkte eingeblendet? Die Hersteller argumentieren mit „Künstlicher Intelligenz“ (KI). Doch kann KI schon so gut sein, dass sie derart präzise in die Zukunft schauen kann? ";https://www.krone.at/2215277;Krone;
01.10.2020;Konzerne intensivieren Überwachung im Home-Office;"Das berichtet der britische „Guardian“ unter Berufung auf Forscher, Bürgerrechtler und Hersteller von IT-Lösungen für das Firmenumfeld. Claudia Pagliari, die an der Universität Edinburgh die Wechselwirkung zwischen Digitalisierung, Gesundheit und Gesellschaft erforscht, bestätigt: „Das nimmt wirklich stark zu.“ Die wachsende Zahl jener, die ihre Arbeit von den eigenen vier Wänden aus verrichten, wecke bei den Arbeitgebern vielfach den Wunsch, sie auch dort verstärkt zu überwachen.

Digitales Einstempeln, Pflicht-Videokonferenzen
Die Methoden, die zur Anwendung kommen, sind vielfältig. „Manche lösen das mit einem einfachen Check-in“, weiß Pagliari. Gewissermaßen ein digitales Einstempeln, das auf vielen Wegen erfolgen könne - beim Login in einen Cloud-Dienst, der von der Firma genutzt werde, oder bei der Anmeldung im firmeninternen Kommunikations-Tool, etwa dem Business-Chat Slack oder dem Rivalen Microsoft Teams. Für viele Manager sei die Erreichbarkeit über solche Plattformen gleichbedeutend mit der Anwesenheit am Arbeitsplatz. Vergisst ein Mitarbeiter, das Tool gleich zu Beginn des Arbeitstages zu starten, vergleicht manch Führungskraft dies damit, als würde er zu spät zum Dienst erscheinen. Auch automatisierte KI-Überwachung und Videokonferenzen etablieren sich als Kontrollmethode: Ein Mitarbeiter eines Kommunikationsdienstleisters berichtet dem „Guardian“ von morgendlichen Pflicht-Videokonferenzen. Offizielle Begründung: Man wolle mit dem Morgen-Meeting die Zahl der übrigen Besprechungen reduzieren, also für mehr Effizienz sorgen. Der Mitarbeiter sieht darin eher eine Maßnahme, um dafür zu sorgen, dass morgens alle vor ihren Rechnern sitzen und ihre Anwesenheit überprüft werden kann. David Heinemeier Hansson weiß um die Überwachungsgelüste der Unternehmen. Als Chef des Business-Kommunikationswerkzeuges Basecamp erhalte er ständig entsprechende Anfragen. Hansson: „Es gibt einen deprimierend großen Bedarf und der kommt meistens von Dinosaurier-Firmen, die durch Covid-19 dazu gezwungen wurden, Home-Office zu ermöglichen. Sie glauben, dass sie nun kopieren oder sogar noch verstärken müssen, was sie sonst im Büro machen.“ Der Start-up-Chef will trotzdem keine Lösungen für die Mitarbeiterüberwachung anbieten. Silkie Carlo von der Bürgerrechts-NGO Big Brother Watch warnt, dass Mitarbeiterüberwachung im Home-Office schnell ins zutiefst Private eindringen können. Der Wunsch, die Mitarbeiter auch bei der Telearbeit zu überwachen wie sonst im Büro, sei eine „natürliche Weiterentwicklung“ der Überwachung im Büro. „Jetzt wird das allerdings zur Heimüberwachung, hat also eine neue Form. Und das ist noch besorgniserregender, weil manche Arbeitgeber nicht verstehen, dass die Mitarbeiter zwar zu Hause arbeiten, das Heim aber trotzdem ein privater Raum bleibt.“ Es gehe hier um die Autonomie und Würde der Mitarbeiter. Carlo fordert gesetzlichen Schutz vor solcher Überwachung und warnt: „Wenn man es sich nicht aussuchen kann, ist es auch nicht freiwillig.“ PwC-Idee: Bildschirmpausen daheim zählen
Manche Arbeitgeber, zum Beispiel in der Finanzwelt, begründen ihre verstärkte Überwachung im Home-Office damit, dass es um ihre Pflicht zur Überprüfung der Regeltreue und ihre Aufsichtspflicht gehe. Der Beratungskonzern PwC hat jüngst mit einem Gesichtserkennungs-Tool für solche Kundschaft Aufsehen erregt, das mitzählt, wie oft die Mitarbeiter im Home-Office sich von ihrem Computer entfernen. Datenschützer sind besorgt, bei PwC betont man, dass es sich um eine rein konzeptionelle Idee handle, die bisher nicht zum Einsatz gebracht worden sei. Eine Produktivitätssteigerung bringen solche Maßnahmen in aller Regel nicht mit sich, weiß Pagliari. Die Forscherin: „Es gibt eigentlich keine Evidenz dafür, dass Arbeiter produktiver wären, wenn man sie überwacht.“ Oft sei eher das Gegenteil der Fall. „Wir wissen, dass das Gefühl, beobachtet zu werden wie in einem Panoptikum, jemanden tatsächlich deprimieren und letztlich weniger produktiv machen kann.“";https://www.krone.at/2241462;Krone;Dominik Erlinger
25.10.2020;IT-Kenntnisse: Was man nach der Schule können muss;"Die OCG bietet in Österreich den Europäischen Computer Führerschein ECDL an - ein anerkanntes Zertifikat für IT-Kompetenzen, das in Schulen und Testzentren abgeprüft wird und IT-Basisfertigkeiten, aber auch spezielleres Know-how zu Bildbearbeitung, Website-Gestaltung oder computergestützten Designanwendungen verbrieft. Auch Wettbewerbe für Schüler und Studenten richtet die OCG aus, weiß also um den IT-Wissensstand der heimischen Jugend. Wir haben mit OCG-Präsident Seyruck, der als Chef der Linzer Software-Firma Programmierfabrik die Fertigkeiten junger Österreicher auch gut aus der Praxis kennt, über den Stand der Dinge bei der IT-Ausbildung gesprochen. Zeitgemäß via Microsoft Teams, versteht sich.

„Krone“: Wie beurteilen Sie die Informatikausbildung an Österreichs Schulen?
Wilfried Seyruck: Ich glaube, der wichtigste Punkt wäre, dass wir früh mit etwas beginnen, das es in aller Welt schon gibt: „Computational Thinking“. Das ist eine Denkschule für Problemlösungen - eine, die für das ganze Leben wichtig ist. Dabei soll geschult werden, zu analysieren, zu abstrahieren und zu verallgemeinern. Man lernt das, indem man Problemstellungen löst und kann damit schon früh anfangen - am besten schon in der Volksschule, weil man dafür quasi nichts braucht beziehungsweise mit einfachsten Hilfsmitteln arbeiten kann. Es gibt dazu auch außerschulische Initiativen, zum Beispiel „Computerscience Unplugged“ oder den „Biber der Informatik“ - ein Wettbewerb für Kinder ab acht für alle Schulstufen, an dem jedes Jahr 2,6 Millionen Schüler aus aller Welt teilnehmen. In Österreich sind es 33.000, unter denen die Mädchen übrigens genauso gut abschneiden wie die Burschen. Überhaupt beobachten wir, dass es unter den 13- bis 14-Jährigen viele Mädchen gibt, die gut in Informatik sind, wegen alter Rollenbilder dann aber leider in andere Berufe gehen. Was wir immer noch sehen ist auch, dass die Anwenderkenntnisse nach der Schule oft nicht gut genug sind - gerade für ein Industrieland wie Österreich. Schulen, die den ECDL pushen, tun sich hier leichter, das ist ein super Nachweis dafür, dass man etwas kann. Natürlich gibt es auch Unterschiede zwischen den Schultypen, aber das „Computational Thinking“ betrachten wir als Kulturtechnik, die man am Ende der Ausbildung können soll, damit keine digitale Zweiklassengesellschaft entsteht. Es geht hier letztlich um Hilfe zur Selbsthilfe.

„Computational Thinking“ ist Teil der „digitalen Grundbildung“, die seit dem Schuljahr 2018/2019 in den Lehrplänen für 10- bis 14-Jährige vorgesehen ist. Ein eigenes Fach hat man dafür aber nicht eingeführt - wäre das sinnvoll?
Ich glaube schon, dass ein eigenes Schulfach gut wäre, um diese Kenntnisse zu entwickeln. Entscheidender Punkt sind hier aber die Problemlösungen: Man kann mit Tools wie Scratch mit einfachsten Mitteln programmieren lernen und das auch gut in anderen Fächern verwenden und zum Beispiel einen Bericht damit schreiben. Welche Rolle spielen außerschulische Angebote bei der Wissensvermittlung?
Angebote wie das CoderDojo (kostenlose, regelmäßig von ehrenamtlichen Mentoren organisierte Programmier-Kurse, Anm.) sind etwas, wo man die Freude junger Leute beim Programmieren sieht. Das ist ein tolles Angebot für alle Altersklassen. Wenn sie bei so etwas dabei sind, sehen sie nach anderthalb Stunden konzentrierter Arbeit ihre Erfolge und Ergebnisse, die Kinder haben daran viel Freude. Sie sind aber kein Ersatz.
Zitat Icon

Wenn wir aus Corona etwas gelernt haben, dann, dass Schulen, die schon bisher viel mit digitalen Medien gearbeitet haben, sich deutlich leichter getan haben. Die haben einfach weitergemacht.

OCG-Präsident Wilfried Seyruck

Wenn wir aus Corona etwas gelernt haben, dann, dass Schulen, die schon bisher viel mit digitalen Medien gearbeitet haben, sich deutlich leichter getan haben. Die haben einfach weitergemacht. Eine Eins-zu-Eins-Umsetzung des normalen Unterrichts ins E-Learning ist aber ohnehin keine Lösung, da muss man Mischformen finden, ein „Blended Learning“, besonders in sehr heterogenen Klassen. Hier sollte man evaluieren, was die Schüler können und bei Bedarf noch einmal gezielt fördern, so dass am Ende alle eine Basisausbildung haben. Es soll keine Verlierer geben - auch nicht bei den Lernmaterialien. Wir hatten eine ECDL-Schule in der Steiermark, in der eine Schülerin keinen Laptop hatte. Da ist die Lehrerin eingesprungen und hat der Schülerin ihr privates Notebook geborgt, das war rührend. Sonst sind solche Schüler verloren, die versumpfen und haben keine Chancengleichheit. Apropos Notebook: Wie steht es denn um die IT-Ausstattung bei den Schülern? Was braucht es denn, um IT-Kompetenz zu erwerben?
Für „Computational Thinking“ braucht man im Prinzip gar nichts und für sehr viel reicht heute ein Browser. Weil alles in der Cloud ist, kommt man auch mit einfacheren Rechnern zurecht. In den USA ist da Google sehr verbreitet, aber Microsoft zieht gut nach. Microsoft hat auch eine Berechtigung, weil man können soll, was man später im Berufsalltag braucht, da gibt es ja gewisse digitale Anwenderkenntnisse.
Zitat Icon

Man sollte Unterschiede zwischen Schultypen beachten: HTL-Schüler brauchen zum Beispiel eher einen High-End-Rechner. Die wollen das auch: Wenn ich mir da eine Klasse anschaue, haben die alle gute Geräte.

OCG-Präsident Wilfried Seyruck

Man braucht also kein High-End-Gerät, keinen Gaming-PC. Man sollte Basisanforderungen definieren und laufend überarbeiten. In der Informatik ändert sich das ja schnell: Die Technik schreitet voran und soll nicht einschränkend werden. Die Welt soll bunt bleiben, man sollte auch keine Hersteller ausgrenzen. Man sollte außerdem Unterschiede zwischen Schultypen beachten: HTL-Schüler brauchen zum Beispiel eher einen High-End-Rechner. Die wollen das auch: Wenn ich mir da eine Klasse anschaue, dann haben die alle gute Geräte. Wichtig sind auch gemeinsame Plattformen, aber heute ist eh alles in der Cloud. Klar ist aber auch: Wenn ich Textverarbeitung betreibe, brauche ich eine Tastatur. Und wer viel vor dem Gerät sitzt, sollte kein 7-Zoll-Tablet nutzen.

Und wie sollte die Beschaffung und Finanzierung umgesetzt werden?
Ich glaube, hier ist es sinnvoll, Investitionen zu nützen, die die Eltern vielleicht schon getätigt haben. Wenn ein Schüler einen Laptop hat, warum sollte er den wegwerfen und ein von der Schule bestimmtes Modell nutzen? Vor diesem Hintergrund finde ich die Initiative der Bundesregierung gut, ein vernünftiges Fördermodell einzuführen, damit es möglich ist, die Ausstattung zu kaufen, die man braucht.
Zitat Icon

Wer nicht in einem Ballungsraum wohnt, soll nicht im Nachteil sein. Natürlich wird ein gutes Netz nicht nur für Schulinhalte genutzt, trotzdem gilt: Je schneller die Internetversorgung in Österreich insgesamt wird, umso besser!

OCG-Präsident Wilfried Seyruck

Genauso wichtig wie der Computer ist heute übrigens eine vernünftige Internetanbindung: Wer nicht in einem Ballungsraum wohnt, soll nicht im Nachteil sein. Natürlich wird ein gutes Netz nicht nur für Schulinhalte genutzt, trotzdem gilt: Je schneller die Internetversorgung in Österreich insgesamt wird, umso besser!

Wie steht es um die Ausstattung an den Schulen selbst?
Da ist man immer ein Stück weit hinten, einfach, weil alles so schnelllebig ist. Ein Computer ist nach drei Jahren veraltet, das muss man berücksichtigen. Es wird aber leichter, je mehr sich alles in die Cloud verlagert. Je mehr Rechenleistung in der Cloud zugänglich ist, umso weniger oft hat man Aufrüst-Bedarf. Wirklich wichtig ist aber die Netzwerkverbindung, hier muss die Ausstattung stimmen!

Wie wichtig eine vernünftige Internetleitung ist, hat der Lockdown gezeigt. Wie haben sich Österreichs Schulen denn beim E-Learning geschlagen?
Manche mussten sich die Verwendung dieser Tools wie Microsoft Teams sehr schnell aneignen. Manche Lehrer nutzten vorher keine digitalen Methoden, die mussten erst die „Basics“ lernen. Das hat teils absurde Situationen erzeugt - etwa Lehrer, die gedruckte Arbeitsblätter scannen, den Schülern zum Ausdrucken schicken und dann einen Scan des ausgefüllten Formulars zurückgeschickt haben wollten. Wichtig wäre also, dass sich die Lehrer auf so etwas vorbereiten und sich fragen: Wie kann ich Computer sinnvoll in den Unterricht einbauen? Wie schätzen Sie denn die IT-Kenntnisse der heimischen Lehrkräfte generell ein? Gibt es da Unterschiede je nach Altersgruppe?
Nein, das hat gar nichts mit dem Alter zu tun, ich weiß von einer Bekannten an der Pädagogischen Hochschule (PH), dass gerade Ältere sich sehr für das Thema interessieren. Sie verlieren auch schnell die Scheu und wollen neue Dinge ausprobieren. An den PHs geht man stark darauf ein. Manche haben es aber auch nie gelernt, vielleicht, weil es doch ein Aufwand ist. Diese Personen sollte man nötigenfalls mit einem maßgeschneiderten Angebot zusätzlich motivieren. Da wären eigene Angebote für Ältere nötig, am besten dort, wo man die Möglichkeiten dafür hat - etwa an den PHs. Man sollte gezielt Lehrer mit ähnlichem Wissensstand fortbilden.
Zitat Icon

Die Lehrkräfte haben eine extrem wichtige Funktion, sie müssen immerhin die künftige Generation ausbilden, die uns ernährt.

OCG-Präsident Wilfried Seyruck

Generell haben die Lehrkräfte eine extrem wichtige Funktion, sie müssen immerhin die künftige Generation ausbilden, die uns ernährt. Sie stehen allein in der Klasse und müssen dort das Wissen nützen, das sie haben. Das muss man sich trauen. Dafür muss es passende Angebote geben und man muss die Bedürfnisse erkennen - etwa, indem man Direktoren einbezieht oder die Bildungsdirektionen. Es geht darum, dass die Lehrer die Vorteile der Technik sehen, wie sie damit ihren Unterricht spannend gestalten können.

Scheitert es auch an der Ausstattung? Dienst-Laptops für Lehrer gibt es nicht und das Lehrerzimmer glänzt meist auch nicht mit Hightech.
Sicher brauchen auch die Lehrer eine gute Ausstattung. Hier hat sich aber schon viel getan, PCs und Whiteboards gibt es heute schon in vielen Klassen und auch mit Beamern und Touchscreen-Geräten kann man im Unterricht viel machen. Ganz allgemein: Was muss ein Schüler am Ende der Schulpflicht heute an IT-Kenntnissen haben, damit er gut ins Berufsleben starten kann?
Da gibt es den DigiCheck 8, der sich stark mit dem ECDL deckt und laut dem man gewisse Anwenderkenntnisse haben und auch die Gefahren der IT kennen sollte. Wenn möglich, sollte man auch den Europäischen Computer Führerschein ECDL gemacht haben. So wie früher ein Auto-Führerschein in den Lebenslauf gehört hat, gehört heute der ECDL hinein. Das ist eine Kulturtechnik, die man können muss. Medienkompetenz sollte man auch mitbringen und wissen, wie man an seriöse relevante Informationen kommt und welchen Quellen man vertrauen kann. So verliert man die Furcht vor Fehlern und traut sich auch eher, etwas auszuprobieren.
Zitat Icon

Als Hightech-Land müssen wir uns bewusst sein: Wer hohe Gehälter zahlt, muss auch gute Leute haben.

OCG-Präsident Wilfried Seyruck

Heutige Lehrlinge bringen einen guten Grundstock an Anwenderkenntnissen mit, können Textverarbeitung, Powerpoint und dergleichen. Es geht aber auch darum, schnell zu sein und zum Beispiel das 10-Finger-System gut zu beherrschen. Es müssen aus unseren Schulen Leute kommen, die sehr gut sind. Als Hightech-Land müssen wir uns bewusst sein: Wer hohe Gehälter zahlt, muss auch gute Leute haben.";https://www.krone.at/2246960;Krone;Dominik Erlinger
16.09.2020;Microsoft holte versenkte Server vom Meeresgrund;"Microsofts erstes Fazit: Ja, sie sind es. Auch wenn die Kapsel mit 864 Servern nach zwei Jahren am Meeresgrund von Algen und Muscheln überwuchert war und erst einmal einer gründlichen Behandlung mit dem Hochdruckreiniger bedurfte, war bei den Servern drinnen alles in Ordnung. Die Zahl der Server-Ausfälle belaufe sich im Vergleich zu klassischen Rechenzentren gar nur auf ein Achtel, berichtete Microsoft in einem Blogeintrag zu seinem sogenannten Projekt Natick. Kapsel mit Stickstoff statt Sauerstoff gefüllt
Damit die Hardware in der wasserdichten Kapsel lange hält, hat Microsoft das zwölf Meter lange versenkte Rechenzentrum mit Stickstoff statt Sauerstoff gefüllt. Dieses Gas reagiert weniger leicht mit der Elektronik als Sauerstoff. Außerdem dürfte die Abwesenheit von Menschen der Technik gutgetan haben, da die Hardware in der Kapsel weniger organischen Einflüssen ausgesetzt ist. Microsoft will nun prüfen, ob nach dem Experiment solche Rechenkapseln künftig auch mehr als zwei Jahre am Meeresboden überdauern könnten und man solche Unterwasser-Serverfarmen zur Erweiterung der eigenen Cloud-Infrastruktur nutzen könnte. Dafür will man die Server aus der Kapsel in der Konzernzentrale im US-amerikanischen Redmond noch einmal genau unter die Lupe nehmen.

Natürliche Kühlung, erneuerbare Energie
Microsoft hofft, mit solchen Rechenkapseln am Meeresboden gleich zwei Probleme lösen zu können. Einerseits brauchen Serverfarmen intensive Kühlung, die im Fall einer solchen Kapsel vom rund vier Grad kalten Wasser am Meeresboden gewährleistet wird. Andererseits könnte man mit solchen Kapseln, wenn man sie etwa direkt aus Windrädern oder anderen erneuerbaren Energiequellen speist, die Klimabilanz verbessern. Ein weiterer Vorteil solcher Rechenzentren wäre laut Microsoft, dass man sie näher am Verbraucher positionieren könnte. Immerhin wohnt ein großer Teil der Weltbevölkerung in der Nähe der Küsten. Wenn sich Projekt Natick bewährt, will Microsoft weitere Rechenzentren versenken und sie nur alle fünf Jahre zur Wartung und zum Tausch ausgefallener Server vom Meeresgrund holen. Microsoft-Manager William Chappell: „Unser Traum ist, zu lernen, wie man Rechenzentren so zuverlässig macht, dass sie keine menschliche Wartung mehr brauchen.“";https://www.krone.at/2231324;Krone;
