Datum;Titel;Text;Link;Quelle;Autor
;"     ""Was ist Künstliche Intelligenz und was kann sie leisten?""";Um die großen Datenmassen beherrschbar zu machen und Nutzen aus ihnen zu gewinnen, sind mehr als herkömmliche Analysewerkzeuge nötig. Obwohl das Phänomen schon seit vielen Jahrzehnten bekannt ist, gewinnt es erst im Big-Data-Zeitalter seine eigentliche Relevanz. Was ist neu an der jüngsten Euphorie rund um Künstliche Intelligenz, Machine Learning und Deep Neutral Networks? Um das zu verstehen, soll im Folgenden sowohl ein genauerer Blick auf KI und die einzelnen Methoden geworfen werden.Was ist überhaupt Künstliche Intelligenz?Künstliche Intelligenz (KI) wird im Allgemeinen als die Fähigkeit von Maschinen definiert, nicht nur mechanische Vorgänge zu beherrschen, sondern auch komplexe mentale Prozesse vollziehen zu können. Die Entwicklung im Bereich der Künstlichen Intelligenz ist bereits einige Jahrzehnte alt. Einer der in diesem Zusammenhang in der Regel genannten Ursprünge ist der Aufsatz von Alan Turing (1912-1954) „Computing Machinery and Intelligence“ aus dem Jahr 1950. Auch der nach ihm benannte „Turing-Test“ wird immer wieder als Kriterium angeführt, anhand dem beurteil werden kann, ob eine Maschine als wahrhaft „intelligent“ bezeichnet werden kann – doch dazu gleich noch mehr.Warum gerade heute KI so interessant istDass gerade in den letzten Jahren verstärkt über Künstliche Intelligenz gesprochen und sogar ihr Durchbruch gefeiert wird, hängt nicht mit einem vertieften wissenschaftlichen Verständnis von Künstlicher Intelligenz oder von der Entwicklung einer neuen Programmiersprache ab. Vielmehr hängt das hauptsächlich damit zusammen, dass die Rechenleistung von Hochleistungsprozessoren so gut geworden ist, dass viele Billionen Rechenoperationen pro Sekunde durchgeführt werden können. Zur Verdeutlichung: Der „konventionelle“ Prozessor im iPhone X schafft mehr als 600 Milliarden Rechenoperationen pro Sekunde. Gleichzeitig sind die Speichertechnologien so günstig geworden, dass große Mengen von Daten sehr schnell verarbeitet werden können. Diese Kombination aus Rechenleistung und Speicherplatz macht es möglich, Maschinen mit einem hohen Grad an Intelligenz auszustatten.Zur Unterscheidung von „starker“ und „schwacher“ Künstlicher IntelligenzZu Beginn einer Auseinandersetzung mit Künstlicher Intelligenz muss aber zunächst eine weitere wichtige generelle Unterscheidung vorgenommen werden, die vor allem begrifflicher Natur ist. Oft wird zwar der Begriff „Künstliche Intelligenz“ verwendet, aber im Grunde genommen wird über zwei sehr unterschiedliche Dinge gesprochen. Es gibt zwei verschiedene Weisen, „Künstliche Intelligenz“ zu definieren: Eine „starke“ und eine „schwache“. Mit „starker KI“, die manchmal auch als „Superintelligenz“ bezeichnet wird, ist jene Form von Künstlicher Intelligenz gemeint, die den Turing Test besteht. Sie könnte also einen Menschen bei einer Versuchsanordnung – dem Turing-Test –, bei dem weder ein Sicht- noch eine Hörkontakt zu den Gesprächspartner vorhanden ist, davon überzeugen, dass sie eine menschliche Person ist, die ein bestimmtes Geschlecht imitiert.Alternativen zum Turing-TestDer Turing-Test ist nicht unumstritten und so gibt es daneben auch andere Versuche, eine starke KI zu definieren. Dabei wird vor allem betont, dass eine starke KI mindestens den Grad an Intelligenz von Menschen aufweisen müsse oder diese übertreffen müsse. Dabei wird angenommen, dass das menschliche Gehirn mit den unterschiedlichsten Aufgaben sehr gut zurecht kommt. Ähnliches muss für eine KI gelten. Diese kann dann als generell intelligent bezeichnet werden, wenn sie viele Aufgaben gleichermaßen gut beherrscht. Als „schwache KI“ wird hingegen das Vermögen definiert, einzelne kognitive Aufgaben mindestens ebensogut oder besser wie Menschen durchführen zu können.Bislang hat keine KI den Turing-Test zweifelsfrei bestanden und die zahlreichen KI-Lösungen, dienen in der Regel einem ganz bestimmten Zweck. Zwar kann IBMs KI mit dem Namen Watson sowohl so programmiert werden, dass er bei einer Quiz-Show teilnehmen und gewinnen kann. Es ist allerdings ebenso möglich, ihn so zu trainieren, dass er bei der medizinischen Diagnose von MRT-Aufnahmen und der Interpretation von Röntgenbildern helfen kann. Beides kann „er“ aber nicht zur gleichen Zeit.Mensch vs. Maschine: Was ist Intelligenz?Auch die Frage „Was ist Intelligenz“ wird nicht oft genug in Zusammenhängen wie diesen gestellt. Dabei ist es durchaus relevant, sich vor Augen zu führen, welche Aspekte von dem, was als Intelligenz verstanden wird, durch Künstliche Intelligenz abgedeckt werden kann. Intelligenz lässt sich unter zahlreichen Gesichtspunkten betrachten. Als emotionale, kognitive oder als soziale Intelligenz. Sie lässt sich aber auch unter dem Aspekt des Bewusstseins diskutieren. Unabhängig vom Stellenwert der einzelnen Komponenten dürfte evident sein, dass menschliche Intelligenz sehr viel mehr Facetten hat. Die bloße Fähigkeit zur Bewältigung von intellektuellen und kognitiven Prozessen macht uns nicht zu intelligenten Wesen. Der Vergleich Mensch-Maschine in Bezug auf den Begriff „Intelligenz“ hinkt auch noch in einer anderen Hinsicht. Der Lösungsweg einer KI ist ein grundlegend anderer als der eines intelligenten Menschen.Eine KI nutzt eine enorme Rechenpower, um in kürzester Zeit gigantische Datenmengen zu durchforsten. Beispielsweise, um Muster in medizinischen Daten zu erkennen, die auf eine Krebserkrankung hinweisen. Ein Arzt, der dieselbe Aufgabe lösen muss, geht nicht im Geiste alle Fälle und alle Referenzen durch, um schließlich zu einem Ergebnis zu kommen. Vielmehr nutzt er Heuristiken, Erfahrung, Abstraktion und regelhaftes Wissen, um schließlich zu einer Einschätzung zu kommen. Es soll hier nicht gesagt werden, dass das eine besser oder schlechter als das andere ist. Es ist aber wichtig festzustellen, dass es sich um grundlegend verschiedene Herangehensweisen handelt. Und auch etwas anderes gehört zur Wahrheit. Ist ein intelligenter Algorithmus erst einmal trainiert, kann er bestimmte Aufgaben oft sehr viel besser bewältigen als Menschen.Künstlich neuronale Netzwerke, Deep Learning und Machine LearningDer eben im Nebensatz erwähnte Aspekte, dass intelligente Algorithmen „trainiert“ werden müssen, ist zentral. Ganz im Gegensatz zu als anderen Computerprogrammen handelt es sich bei KI-Software nicht um „Out-of-the-box-Lösungen“. Sie werden nicht einmal erstellt und können dann in der Folge wie andere Software immer wieder angewendet werden. Vielmehr handelt es sich um lernfähige Algorithmen, die zunächst trainiert werden müssen und im Laufe ihrer Anwendung immer besser werden. Das macht auch den Charme von bestimmten Geräten und Maschinen aus. Dank Machine Learning werden beispielsweise die Kameras in Smartphones von Google permanent verbessert. Sie lernen mit der Zeit zu verstehen, was auf Bildern zu sehen ist und nehmen entsprechend Optimierungen vor.Dabei gibt es unterschiedliche Lernmethoden wie „künstlich neuronale Netzwerke“, „Deep Learning“ oder „Machine Learning“, um nur die derzeit wichtigsten zu nennen. Auch Machine Learning lässt sich wiederum nochmal nach Lernmethoden unterscheiden. Einerseits in solche Algorithmen auf Basis eines Trainings-Sets selbst optimieren können. Andererseits in solche, bei denen Programmierer beziehungsweise Anwender dem Programm ein Feedback geben, ob bestimmte Ergebnisse richtig sind oder nicht. Je nachdem wie das Feedback ausfällt, kann ein intelligentes Programm Anpassungen für die Zukunft vornehmen. So kann es im Lauf der Zeit immer bessere Antworten geben. Ein entscheidender Aspekt, wenn es darum geht, die Anwendbarkeit und das Potenzial von KI einzuschätzen. ;https://bigdatablog.de/2017/11/13/kuenstliche-intelligenz/;BigDataBlog;Christian Schön
;" Retweets,      ""Smartes Bier ohne Reinheitsgebot? Mit Big Data und Predictive Analytics dem perfekten Bier auf der Spur.""";In Deutschland und insbesondere in der Hauptstadt des Bieres in München ist die Sache mit dem Bier eigentlich klar: Nichts geht hier über das Reinheitsgebot. In Belgien, Schweden oder den USA sind die Brauereien sehr viel experimentierfreudiger und zumindest in Wettbewerben um das beste Bier des Jahres gibt ihnen der Erfolg recht. Die meisten der ausgezeichneten Biere kommen aus diesen Ländern und oft handelt es sich um kleine Mikro-Brauereien, die sich auf eine Marktnische spezialisiert haben.Der Brauprozess ist sehr komplex und durch die Auswertung von Sensordaten und mit der Hilfe von Algorithmen kann der Biergenuss heute verbessert werden. Um das perfekte Bier zu brauen, setzt beispielsweise eine Brauerei aus Portland, Deschutes Brewery, auf Big Data. Ihr Business-Plan sieht vor, pro Jahr verschiedene neue Sorten auf den Mark zu bringen und gleichzeitig die Qualität auf einem konstant hohen Niveau zu halten – und das zum Teil auch bei kleineren Produktionsmengen. Insbesondere für eine kleine Brauerei ist dies ein schwierig zu erreichendes Ziel, das aber dank Predictive Analytics erreicht werden kann.“Mit Big Data zum perfekten Bier: Wie Predictive Analytics hilft, den Brauprozess zu optimieren“ Twittern WhatsApp.Mit Sensordaten und Datenmodellen zum perfekten BierDer Brauprozess wird in etliche unterschiedliche Phasen eingeteilt: Mälzen, Schroten, Maischen, Läutern, Würzekochen, Hopfengabe, Würzeklärung, Würzekühlung, Gärung, Reifung, Filtrieren und schließlich die Abfüllung. Jede dieser einzelnen Phasen hat Auswirkungen auf das Endergebnis – darüber hinaus können auch verschiedene Hopfen- oder Gerstesorten eine charakteristische Note hinterlassen. Jedoch haben insbesondere die Vorgänge, bei denen der angesetzte Sud erhitzt und abgekühlt wird, einen entscheidenden Einfluss auf den Geschmack und die Qualität des Bieres.Mit Sensoren lassen sich die Übergänge zwischen den Vorgängen des Befüllen des Tanks und der Fermentation, der Zugabe der Hefe sowie zwischen dem Abkühlen und dem Reifungungsprozess überwachen. Sie zeichnen dabei zahlreiche Werte wie Temperatur, Druck oder PH-Werte auf. Zunächst werden die Algorithmen mit Testdaten gefüttert, damit sie nach und nach genaue Vorhersagen über die Entwicklung des Brauprozesses machen können. Wenn erst mal ein Modell für den Übergang zwischen zwei Phasen erstellt ist, lassen sich die Erkenntnisse auf andere Prozesse übertragen. Das Ziel ist es, den gesamten Brauprozess einerseits so effizient wie möglich zu machen, um die Kapazitäten der Anlagen voll auszuschöpfen. Andererseits können die Predictive-Analytics-Algorithmen die Qualität des Bieres immer gleich hoch und das Geschmackserlebnis konstant gehalten werden. Da chemische Prozesse nicht immer exakt gleich ablaufen, ist diese Form des Smarten Bierbrauens, das auf Echtzeitanalysen basiert, gegenüber herkömmlichen Methoden im Vorteil.Der Braumeister Brian Faivre von Deschutes Brewery setzt auf Big Data: Neben chemischen Prozessen sind nun auch technische Prozesse fehleranfällig.AI bringt Bierbrauer und Kunden zusammen: Gelebte KundenzentrierungNeben dem Fokus auf den Brauprozess mit Big Data, lassen sich Algorithmen auch dazu verwenden, um Bier dem Geschmack der Kunden anzupassen. Kunden können heute via Smartphone den Unternehmen eine direktes Feedback geben, ob sie mit dem gekauften Produkt zufrieden sind. Ein britischer Bierbrauer macht sich diese Informationen zunutze und passt mithilfe Künstlicher Intelligenz (AI) den Geschmack seines Biers den Wünschen der Kunden an. Gleichzeitig versucht er durch das Feedback die Qualität seines Erzeugnisses permanent zu verbessern:Durch das Einscannen eines individuellen Codes auf den Etiketten kann ein AI-Bot die Bewertungen der Kunden exakt zuordnen und auswerten.“AI und Mashine Learning lassen Kunden direkt mit Brauereien kommunizieren mit einem gemeinsamen Ziel: Besseres Bier“ Twittern WhatsAppNicht nur der Brauprozess kann mit Hilfe von Datenauswertungen verbessert werdenDer Genuss eines Bieres hängt auch vom richtigen Zeitpunkt des Öffnens der Flasche und der perfekten Trinktemperatur ab. Auch hier können Algorithmen helfen: Ab welchem Zeitpunkt verliert ein abgefülltes Bier den charakteristischen Geschmack, für den man es gekauft hat? Dieser Zeitpunkt lässt sich exakt messen und beispielsweise auf dem Etikett angeben. Auch die perfekte Lager- und Trinktemperatur lassen sich so ermitteln und kommunizieren. Vorreiter ist auch hier die Deschutes Brewerey, die nicht mehr das Haltbarkeitsdatum ihrer Biere auf dem Etikett angibt, sondern auch exakt den Zeitpunkt bestimmen kann, ab dem bestimmte Geschmackskomponenten nicht mehr zu schmecken sind.Solche Vorteile lassen sich nicht nur bei Getränken wie Bier nutzen, sondern auch bei Whiskey. Jede Flasche der Marke Johnnie Walker ist heute ein Teil des Internet der Dinge. Für das Unternehmen ergeben sich daraus eine ganze Reihe von Vorteilen – so kann beispielsweise die gesamte Lieferkette überwacht und auf diese Weise der Diebstahl von Waren minimiert werden. Aber auch für den Kunden selbst ergeben sich Vorteile: Er erhält einen genauen Überblick über die Historie der Lagerung jeder einzelnen Flasche. So kann sichergestellt werden, dass beispielsweise die Lagertemperatur immer optimal war.Mit jedem Smartphone lassen sich zahlreiche Daten über den Lebenszyklus der individuellen Flasche und zusätzlicher Content für die Kunden abrufen.Die Digitalisierung aller Lebensbereiche macht auch vor dem Reinheitsgebot nicht haltDer Kontrast könnte größer kaum sein: Auf der einen Seite das Reinheitsgebot und alte Kellergewölbe, in denen Fässer mit Bier, Wein oder Whisky lagern und auf der anderen Seite Sensoren, Algorithmen und Big Data. Die Digitalisierung aller Lebensbereiche kennt kaum Grenzen und bringt zahlreiche Vorteile für die Kunden und für Unternehmen mit sich. Mit dem Wissen über den Brauprozess können beispielsweise kleinere Brauereien wie die Deschutes Brewerey ihr Geschäftsmodell kontinuierlich erweitern: Neue Geschmacksrichtungen lassen sich schneller entwickeln und entsprechend vermarkten. Die Kunst besteht heute darin, geeignete Datenquellen zu finden oder zu schließen, um einerseits Daten zu sammeln und andererseits aus diesen Datenmengen konkretes Wissen zu ziehen. Die Digitalisierung schafft damit etwas, das besonders hierzulande als heilig gilt: Die Verbesserung des Reinheitsgebotes.Wenn wir das aber anders denken wollen, zitiere ich gerne Antje Neubauer, die sagt: „Wir haben als Unternehmen auch eine gesellschaftliche Verantwortung, die wir ernst nehmen, indem wir Haltung zeigen und auf Werte verweisen, die in unserer Demokratie selbstverständlich sein sollten.“ Big Data hat Vorteile, aber die Verantwortung über die Daten und damit verbunden die Werte die ein Unternehmen hat, ist immer ethisch zu durchdenken.;https://bigdatablog.de/2017/02/10/smartes-bier-ohne-reinheitsgebot-mit-big-data-und-algorithmen-dem-perfekten-bier-auf-der-spur/;BigDataBlog;Ibrahim Evsan
09. Jan 17;" Retweets,      ""Big Data und Deep Learning: Wie Maschinen Bilder verstehen können und visuelle Navigation die Welt der Bilder erschließen.""";Bilder sind Zeichen. Diese wichtige Einsicht ist nicht selbstverständlich. Da Bilder auch die Realität abbilden, können wir „verstehen“, was wir auf Bildern sehen, weil es diese Ähnlichkeitsbeziehung gibt. Sehen wir ein Bild von einem mit Gras bewachsenen Hügel, auf dem ein Mensch steht, der den Sonnenuntergang betrachtet, verstehen wir dieses Bild, weil wir Hügel, Mensch und Sonnenuntergängen aus unserer Erfahrung heraus kennen. Aber wie bringt man einem Computer bei, was auf Bildern zu sehen ist, wo ihnen doch sowohl diese Form der Seh-Erfahrung und das Weltwissen als auch unser Bild-Verständnis fehlen? Diese Frage ist alles andere als trivial, weil sie doch darüber entscheidet, ob und wie Unternehmen, die über gigantische Archive verfügen, Bilder verwalten und die darin steckenden Informationen nutzen können.Die Frage ist also, wie es gelingen kann, Computern beziehungsweise intelligenten Programmen beizubringen, was überhaupt auf Bildern zu sehen ist und wie dieser Bildinhalt zu verstehen ist. Es gibt eine ganze Reihe von Bildtypen, die wir problemlos lesen können, und das obwohl es in einigen Fällen den eingangs erwähnten Realitätsbezug nicht gibt oder obwohl die Bedeutung dessen, was ein Bild darstellt, komplexer ist als der reine Ähnlichkeitsbezug. Ein Symbol ist beispielsweise mehr als ein bloßes Abbild eines Gegenstandes. Mit einer Rose oder einem Herz können wir starke Affekte wie Liebe zum Ausdruck bringen und wollen dem Gegenüber nicht nur das Bild einer bestimmten Pflanze oder eines Organs zeigen. Auch Gemälde oder mit Photoshop veränderte Fotografien zeigen nicht mehr einfach nur die Realität, sondern erzählen Geschichten, machen vielleicht Anspielungen auf andere Bilder oder verwenden einen speziellen Code.In Anlehnung an René Magrittes Gemälde „Ceci n’est pas une pipe“ (© Katja Gerasimova @ Shutterstock.com). Können Computer mit Hilfe von Deep Learning den Unterschied zwischen einer Pfeife und dem Bild von einer Pfeife verstehen?Warum Google Bilder findet… und warum nichtDie Bildsuche von Google gibt es zwar seit vielen Jahren. Diese funktionierte aber lange Jahre nur deshalb, weil der Suchalgorithmus von Google die Texte durchsuchte, in denen auch Bilder vorkamen. Die Begleittexte lieferten die gesuchten Stichworte und so kam das Ergebnis zustande. Die Annahme, dass Texte und Bilder zusammengehören und sich gegenseitig erklären, musste als Annahme gegeben sein, damit die Google Bilder-Suche erfolgreich war. Während Google inzwischen auf Deep-Learning-Algorithmen umgestellt hat, basieren Bildsuchen in anderen Bildarchiven großen Teils noch auf der Verschlagwortung von Bildern, sprich: Metadaten. Bildagenturen wie Shutterstock oder 500px lassen ihre Kunden beim Upload die entsprechenden Keywords hinzufügen. Eine solche Kombination aus Text und Bild stellt eine effektive Möglichkeit dar, um mit Bildern umzugehen. Aber diese Methode hat genau an diesem Punkt auch ihre Grenzen: Beispielsweise aufgrund von Homonymen, also Wörtern die etwas unterschiedliches bezeichnen, obwohl sie genau gleich klingen oder geschrieben werden. Sie können zu falschen Suchergebnissen führen. Eine Bildsuche nach „Golf“ kann sowohl zu Ergebnissen beinhalten, die ein Auto der Marke VW enthalten oder die eine bestimmten Sportart darstellen, aber sogar eine Meeresformation zeigen (z.B. „Golf von Mexiko“).Auch Falschschreibungen von den Suchenden selbst können das Suchergebnis verfälschen oder zumindest die Suche erschweren. Nicht nur, dass solche Methoden per se keine adäquate Lösung des Problems darstellt, es stellt sich darüber hinaus die Frage: Was machen wir mit Bildarchiven, die aus vielen Millionen von Bildern bestehen? Diese von Hand durchzugehen und mit Stichworten zu versehen, ist ein Ding der Unmöglichkeit oder zumindest hochgradig ineffizient. Deep Learning, ein Teilaspekt von Machine Learning, basiert auf der Idee von neuronalen Netzwerken. Algorithmen dieser Art können, sind sie erst einmal trainiert, erstaunliche Dinge leisten: “Mit der Hilfe von #DeepLearningAlgorithmen lernen Computer, Bilder zu verstehen. #BigData“ Twittern WhatsAppWie klassifiziert Facebook alle Bilder, die auf die Plattform hochgeladen werden?Auch Facebook arbeitet seit längerem an einem auf künstlicher Intelligenz beruhenden Algorithmus, der dazu in der Lage ist, Bilder zu verstehen. Das Ziel ist es unter anderem die nur visuell wahrnehmbaren Inhalte auch all den Menschen zugänglich zu machen, die blind oder sehbehindert sind. Allein in Deutschland, für das bezeichnender Weise exakte Zahlen fehlen, handelt es sehr wahrscheinlich um weit mehr als 1,2 Mio. Menschen (Stand: 2002).Wie genau und wie umfassend Facebook dabei ist, Bilder erkennen zu lassen, lässt sich mit der frei erhältlichen Extension für Google Chrome nachvollziehen. Mit„Show Facebook Computer Vision Tags“ lassen sich alle Labels sichtbar machen, die Facebook einem Bild automatisch zuordnet:Auch mit dem kostenlosen Online-Tool „akiwi“ ist es möglich, für seine eigenen Bilder solche Keywords zur Verschlagwortung automatisch finden zu lassen. Akiwi entstand als Studentenprojekt im Kontext der Forschung der Hochschule für Technik und Wirtschaft Berlin (HTW), wo man sich seit längerem mit Deep Learning und visueller Navigation sowie Bildanalyse beschäftig. All diese Versuche stehen aber an der Schnittstelle zwischen Bilderkennung und Verfahren zur textbasierten Bildsuche.Bilder als wichtige Datenquelle erschließenInzwischen verfügen nicht nur soziale Netzwerke, Bild- und Medienagenturen sowie Foto-Communities wie Flickr und E-Commerce-Händler über unvorstellbare Mengen an Bilddaten. Nahezu jedes größere Unternehmen hat in seinen Daten-Archiven neben Textdokumenten, Tabellen oder Maschinendaten auch Bilder gespeichert. Angesichts der Unzulänglichkeiten der textbasierten Bildsuche stellt sich die dringliche Frage, wie es möglich ist erstens Algorithmen zu entwickeln, die selbständig Bilder erkennen und zweitens ob es neue Wege gibt, Bilder zu durchsuchen. Darum beschäftigen sich die Forscher an der HTW mit neuen visuellen Verfahren, zur Darstellung von großen Bilddatenbanken und zur Bildsuche. Das Prinzip von Google-Maps aufgreifend stellt Picsbuffet Bilder in Form einer Bilder-Landkarte dar, über die die Nutzer in Vogelperspektive fliegen.Dieses neue Prinzip, Bilder darzustellen, hat gegenüber herkömmlichen Darstellungsformen, bei denen Listen von oben nach unten durchsucht werden müssen, viele Vorteile: Duplikate werden sofort erkannt und ähnliche Bilder in Gruppen dargestellt. Nimmt man das praktische Beispiel E-Commerce, so wird es durch die alternative Darstellungs- und Suchform möglich, ähnliche Produkte auf einen Blick zu finden. Aber nicht nur bei der Produktsuche können mit Deep-Learning-Algorithmen neue Präsentationsformen entwickelt werden. Auch bei der Suche nach urheberrechtswidrig gebrauchten Bildern wäre eine auf den Prinzipien von Deep Learning basierte Bildsuche überlegen.Deep Learning: Maschinen lernen, Bilder zu sehen und zu verstehenEntwicklungen in diesem Bereich sind darum so wichtig, weil sie einen wichtigen Bestandteil beim Autonomen Fahren spielen. Bilderkennung ist insofern wichtig, als dass autonom fahrende Autos Bilder wie Verkehrszeichen sehen und richtig kategorisieren können müssen. Sobald die Deep-Learning-Algorithmen einmal trainiert sind, leisten sie erstaunliches. Das „German Traffic Sign Recognition Benchmark“ des Instituts für Neuroinformatik der Universität Bochum übertraf schon vor vielen Jahren die Leistung von Menschen bei der selben Aufgabe bei weitem. Doch nicht nur weil Deep-Learning-Algorithmen exakter und schneller arbeiten, sind sie in Zukunft unverzichtbar. Allein durch die schiere Menge der Datenmassen ist es notwendig, Maschinen das Sehen und Verstehen von visuellen Informationen beizubringen. Deep-Learning-Netzwerke schaffen die Grundlage zur Verwaltung von Big Data, erschließen das wirtschaftliche Potenzial, das in Bilddaten steckt, und stellen einen wichtigen Baustein für weitere künftige Entwicklungen dar. Während heute daran gearbeitet wird, die Mensch-Maschine-Kommunikation mittels natürlicher Sprache zu optimieren, wird es in Zukunft möglich sein, dass Maschinen ihre Umwelt sehen und interpretieren können.;https://bigdatablog.de/2017/01/09/big-data-und-deep-learning-wie-maschinen-bilder-verstehen-koennen-und-visuelle-navigation-die-welt-der-bilder-erschliessen/;BigDataBlog;Christian Schön
