Datum;Titel;Text;Link;Quelle;Autor
21. Okt 15;" Retweets,      ""MongoDB und Pentaho: Real-Time Analytics mit NoSQL""";MongoDB und Pentaho: Real-Time Analytics mit NoSQL | © kentoh @ Shutterstock.comSeit Pentaho die Version 5.1 seiner Business Intelligence Suite veröffentlicht hat, lassen sich native Business Intelligence-Analysen auch direkt auf nicht-relationalen MongoDB-Speichern durchführen. Der Pentaho Analyzer ist damit die erste echte End-to-End-Analyselösung für MongoDB. Das Tool ermöglicht es dem Anwender, die Vorteile der dokumentenorientierten Datenbank in puncto Flexibilität und Geschwindigkeit voll auszuschöpfen. Zeit, einen Blick auf MongoDB, den Marktführer im Bereich NoSQL-Datenbanken, zu werfen.MongoDB ist zwar erst seit 2009 am Markt, doch bereits eine der führenden NoSQL-Datenbanken. Es wurde mit dem Ziel entwickelt, die strukturbedingten Begrenzungen traditioneller Datenbankensysteme zu durchbrechen, um den steigenden Anforderungen an die Geschwindigkeit von Datenverarbeitungen und -auswertungen gewachsen zu sein. Konkret beinhalten NoSQL-Umgebungen die Möglichkeit, unstrukturiert vorliegende Daten zu erfassen. Der entscheidende Unterschied zu relationalen Datenbanksystemen besteht darin, dass MongoDB auf feste Tabellenschemata verzichtet und Dokument-orientiert arbeitet.Dokumentenbasierte Speicherung und dynamische SchemataEine der Kerntechniken von MongoDB ist die dokumentenbasierte Speicherung der Daten. MongoDB ist auf ein dynamisches Schema ausgelegt, dass sich neuen Daten flexibel anpassen kann. Auf MySQL-typische Relationstabellen und Joins, die mit dem Ausbau der Datenbank immer komplexer werden, wird verzichtet. Um Dokumente mit ähnlicher Struktur zusammenzufassen, nutzt das Datenbankmanagementsystem sogenannte Collections. Die einzelnen Dokumente können eine beliebige Anzahl frei definierbarer Felder besitzen, und auch verschachtelte Array-Strukturen sind möglich.Daten werden in Form von Dokumenten im BSON-Format (Binary JSON) abgespeichert. Durch die Java-nahe Notation eignet sich MongoDB insbesondere für Web-Anwendungen, da die Daten ohne Transformation direkt vom Datenbanksystem abgespeichert werden können. Bei MongoDB gibt es keine Abfragesprache wie SQL. CRUD-Operationen (create, read, update, delete) werden durch objektspezifische Methoden der jeweiligen Programmiersprache realisiert, die in verschiedenen Client-Drivers zusammengefasst sind. MongoDB unterstützt alle im Web gängigen Programmiersprachen wie JavaScript, Perl, Python oder Ruby.Performance, Skalierbarkeit und Ausfallsicherheit von MongoDBMongoDB eignet sich vor allem für Anwendungen mit einem hohen Datenvolumen und Datendurchsatz, also im Bereich Real-Time-Analytics. Ausschlaggebend sind dafür die horizontale Skalierung über Sharding und das Memory-Mapping.Beim Sharding werden die Daten anhand des Shardingkeys auf mehrere virtuelle Maschinen aufgeteilt (in sogenannte Chunks). Der Config-Server gibt Auskunft darüber, wo welche Shards hinterlegt sind. Synchronisiert werden sie von mongos, eine Art Router. Vorteil des Shardings: der Arbeitsaufwand, wie er zum Beispiel beim Abfragen von Daten entsteht, wird parallel durch mehrere Rechner erledigt. Das liefert eine hohe Performance und minimiert die Gefahr von möglichen Engpässen (Bottlenecks). Durch Verarbeitungsgeschwindigkeiten, die mit einem In-Memory-System vergleichbar sind, ermöglicht MongoDB die Auswertung von Daten in Echtzeit.Die Ausfallsicherheit wird bei MongoDB durch Replica Sets sichergestellt. Ein Replica Set besteht aus mindestens einem Primär- und einem Sekundärknoten. Fällt das primäre Replikat aus, beispielsweise aufgrund von Hardware- oder Softwareproblemen, wählt MongoDB ein sekundäres Replikat und konfiguriert es als neues Primärreplikat. Das ausgefallene Replikat wird nach der Wiederherstellung automatisch als Sekundärreplikat konfiguriert.MongoDB: Anwendungsfälle und AnwenderMongoDB wird von namhaften Anwendern für die gängigen BI-Bereiche ETL, OLAP und Data Mining angewendet.Case 1: High Volume Data FeedsBig Data, also riesige Datenströme, zeichnen sich dadurch aus, dass sie extrem schnell erzeugt werden und in sehr unterschiedlicher Form vorliegen. Häufig werden dabei semi- oder unstrukturierte Datenquellen verwendet. Auch das Format und die Struktur der Daten kann stark variieren. Für die schnelle Verarbeitung dieser Daten sind daher besonders skalierbare und performante Datenbankmanagementsysteme notwendig, die flexibel bezüglich der Struktur und der Datenformate sein müssen. MongoDB bietet diese Möglichkeiten und wird deshalb im Big-Data-Kontext gerne eingesetzt, zum Beispiel von dem Online-Netzwerk Craigslist und dem Sicherheitssoftware-Hersteller McAfee.Case 2: Operational IntelligenceHinter dem Begriff Operational Intelligence (OI) verbirgt sich eine neue, dynamische und in Echtzeit agierende Form der Datenauswertung. Bei OI werden maschinengenerierte Daten in Echtzeit geladen und verarbeitet. Möglich ist das durch ein direktes Ablegen und Indexieren der Daten. Eine spezielle Transformation der Maschinendaten, wie z.B. bei Log- und Sensordateien, ist nicht notwendig. So können ungewöhnliche Ereignisse schneller identifiziert und analysiert und eventuelle Fehler rascher behoben werden.Operational Intelligence wird gerne für Real-Time-Dashboards verwendet. In diesen Dashboards lassen sich Ereignisse ohne große Verzögerung graphisch darstellen. Neue Möglichkeiten bietet OI auch im Marketing-Bereich. Hier wird MongoDB als Grundlage für AD-Targeting und Social Media Monitoring verwendet. Bekannte Nutzer des Datenbankmanagementsystems im OI-Sektor sind z.B. der CRM-Entwickler Salesforce und die Kreativagentur Razorfish.Case 3: Content ManagementContent-Management-Systeme dienen zur Speicherung und Verwaltung von Informationen und Metadaten für eine Reihe von Anwendungen wie Webseiten und Datenarchive. Inhalte sind heute viel komplexer und bestehen neben Texten auch aus Bildern, Tönen, Videos und integrierten sozialen Medien. Die Mehrheit der Datenbankmanagementsysteme (DBM) stößt dabei schnell an ihre Grenzen, weil sie die heterogenen Daten nur unter großem Aufwand bzw. durch Kombination verschiedener DBMs verwalten können.“Ihr wollt wissen, wie ihr #MongoDB anwenden könnt? – 3 Beispiele #NoSQL #Data“ Twittern WhatsAppEine Alternative ist MongoDB. Die dokumentenorientierte Speicherform und das dynamische Schemadesign ermöglichen die effiziente Verwaltung der heterogenen Daten unabhängig von Herkunft und Struktur. Alle Daten können durch einen einzigen Datenspeicher repräsentiert werden. Dadurch ist es vergleichsweise einfach möglich, inhaltsreiche Anwendungen zum Beispiel mit personalisiertem Inhalt und Layout aufzubauen. Im Umfeld Content Management setzen das Reiseportal Expedia und der Softwareentwickler SAP MongoDB ein.Die Beispiele zeigen, dass NoSQL im Business-Intelligence-Bereich eine immer größere Rolle spielt. Im nächsten Beitrag „BI-Analysen der nächsten Generation“ wenden wir uns der BI-Suite von Pentaho zu und zeigen, was das quelloffene Open Source-BI zusammen mit MongoDB im Unternehmenseinsatz leisten kann.;https://bigdatablog.de/2015/10/21/mongodb-und-pentaho-real-time-analytics-mit-nosql/;BigDataBlog;Stefan Müller
15. Okt 15;" Retweets,      ""Das Amazon Development Center in Berlin: Ein Gespräch über die Zukunft von Big Data""";Amazon ergänzt seit einigen Jahren seine Geschäftsfelder im Bereich Big Data Dienstleistungen. In Berlin wurde dafür das Amazon Development Center für Mashine Learning eröffnet. Dort sollen nicht nur neue Services für externe Kunden weiterentwickelt werden, sondern auch ein Ort für Zusammenarbeit entstehen. E-Book-Autoren treffen auf Entwickler, Entwickler auf die Startup-Szene. Der Dircetor of Machine Learning Science, Dr. Ralf Herbrich, hat sich für unsere Fragen Zeit genommen.This Interview is also available in EnglishHerr Herbrich, in Berlin gibt es bereits seit 2013 Amazon Web Services, worüber Big-Data-Dienstleistungen wie die Stimmungsanalyse durch die Auswertung von Twitter-Mitteilungen genutzt werden können. Wie unterscheiden sich davon die Dienstleistungen, die Sie im neuen Amazon Entwicklungszentrum anbieten?Amazon arbeitet beständig an Innovationen für seinen Kunden. Das Berlin Development Center ist dafür ein großartiges Beispiel. Im Berliner Development Center arbeiten wir an der Entwicklung der nächsten Gerneration von Amazons Technologien mit dem Fokus auf Machine Learning und Verteilten Systemen. Das Development Center ist eigentlich auch schon seit 2013 in Berlin und war zunächst in einem temporären Büro in Berlin Charlottenburg, bis wir im Juni 2015 in die Krausenhöfe in unser neues Büro eingezogen sind.Neben anderen Teams, bietet das Büro inzwischen auch Amazon Web Services (AWS), dem AWS OpsWork Team und dem Amazon Machine Learning Team eine Heimat. Einige der Technologien, die von diesen Teams entwickelt werden, sind bereits live und für die Kunden verfügbar wie beispielsweise Amazon Machine Learning und AWS Ops Works. All diese Technologien ermöglichen es, unseren Kunden neue Möglichkeiten zu bieten – seien das die neuen Features für AWS oder die internen Möglichkeiten, die es uns erlauben, die Amazon Pakete noch schneller an die Amazon Einzelhandelskunden zu liefern.;https://bigdatablog.de/2015/10/15/amazon-development-center-fuer-machine-learning/;BigDataBlog;Christian Schön
03. Sep 15;" Retweets,      ""Superschnelle Datenintegration: Pentaho integriert Apache Spark""";Gute Neuigkeiten für die Anwender der Big Data-Tools Pentaho und Apache Spark: Pentaho Data Integration (PDI) verfügt zukünftig über eine native Integration von Spark. Das beschleunigt Datenintegrationsprozesse für Big Data-Analysen enorm.Der Big Data-Hersteller Pentaho Corporation hat kürzlich die native Integration von Pentaho Data Integration (PDI) mit Apache Spark bekannt gegeben. Damit können Datenintegrations-Jobs mit Spark direkt aus Pentaho gesteuert werden. Die Integration hat die Big Data-Szene aufhorchen lassen, denn dadurch lässt sich die Produktivität von Daten-Projekten stark steigern, Wartungskosten reduzieren und die für Spark erforderlichen Mitarbeiterqualifikationen deutlich senken.Spark-Framework ergänzt PDIApache Spark ist ein Cluster-Computing-Framework, das entwickelt wurde, um anstelle von Hadoop MapReduce auf der Oberseite des Hadoop Distributed File-Systems (HDFS) zu laufen. Bei der Entwicklung wurde besonderer Wert auf Schnelligkeit, Benutzerfreundlichkeit und maschinelles Lernen geachtet. PDI ist im Wesentlichen eine tragbare Datenaufbereitungsmaschine für ETL, die als Stand-Alone-Pentaho-Cluster oder in einem Hadoop-Cluster über MapReduce oder Yarn eingesetzt werden kann. Mit Spark wird PDI um ein neues Framework ergänzt, durch das Big Data ETL-Prozesse noch schneller durchgeführt werden können. Anwender können ETL-Jobs mit Hilfe der grafischen Design-Umgebung im PDI entwickeln, testen und optimieren und später auf Spark laufen lassen. Da beide Lösungen auf Open Source basieren, war es für Pentaho einfach, das ebenfalls quelloffene Spark-Projekt zu integrieren.Was bringt die Integration Big Data-Usern?Durch die Unterstützung für In Memory Cluster-Computing kann mit Spark eine Leistung erreicht werden, welche die von Hadoop MapReduce deutlich übersteigt. Dadurch sind Analysen in Echtzeit möglich. Das bedeutet, dass Anwender keine separate Technologie mehr benötigen, um Realtime Analytics durchzuführen. Darüber hinaus umfassen die großen Arbeitslasten solcher Auswertungen typischerweise unterschiedliche Datentypen, die jeweils auf bestimmte Art und Weise analysiert werden müssen. Das ist eine weitere Stärke von Spark.Einsatzbereiche für Spark und PentahoPentaho arbeitet gerade daran, Beispiel-Szenarien für den Einsatz von Spark zu entwickeln. Damit möchte das Unternehmen die Anwender dabei unterstützen, die richtigen Einsatzbereiche für Spark und Pentaho zu finden und Big Data-Projekte einfacher umzusetzen. Dazu gehören unter anderem direkt auf Spark SQL ausgeführte Abfragen und parallel durchgeführte Spark-Abfragen (Spark Parallel Execution).“#Pentaho integriert #ApacheSpark – das beschleunigt Prozesse für #BigData-Analysen enorm.“ Twittern WhatsAppDer Big Data-Markt befindet sich in einem kontinuierlichen Wandel. Spark gehört zu den Projekten in diesem Bereich, an denen am aktivsten gearbeitet und mitentwickelt wurde. Die Lösung besitzt daher strategische Bedeutung für einen Big Data -Anbieter wie Pentaho. Durch den Open Source-Ansatz können neue Technologien einfach integriert werden und bietet Kunden aktuelle Innovationen – ein enormer Vorteil in einem so dynamischen Markt wie dem für Big Data-Anwendungen.;https://bigdatablog.de/2015/09/03/pentaho-integriert-apache-spark/;BigDataBlog;Stefan Müller
24. Aug 15;" Retweets,      ""Big Data als Voraussetzung für das Semantic Web""";Einer der Pioniere der Computertechnologie, Alan Turing, träumte bereits davon, dass es einmal möglich sein wird, sich mit einer Maschine zu unterhalten. Mit Big Data und dem Semantic Web könnte Turings Traum bald Wirklichkeit werden. Der nach Alan Turing benannte “Turing-Test” ist eine Versuchsanordnung, bei der eine Person einem Gegenüber Fragen stellt. Allerdings sieht der Fragensteller sein Gegenüber nicht, weiß damit auch nicht, ob ihm eine Maschine oder ein Mensch antwortet. Die Antworten selbst sollen Aufschluss darüber geben, ob ein Mensch sie gegeben hat oder nicht. Eine künstliche Intelligenz, der es möglich ist, Sprache und Bedeutung zu verstehen, muss sehr viele Informationen auf einmal auswerten.Wie das Semantic Web Sprache verstehtDas Wort “Golf” kann ganz verschiedenes bedeuten. Es ist eine Sportart, ein Autotyp, aber auch der Teil des Meers wie der Golf von Mexiko. Wann welche Bedeutung des Wortes gemeint ist, hängt stark vom Kontext ab. In einem Gespräch ist uns sehr schnell klar, was jeweils mit Golf gemeint ist. Wenn jemand allerdings in den Google-Suchschlitz das Wort Golf eintippt, weiß der Suchalgorithmus im Regelfall nicht automatisch, wonach wir suchen. Inzwischen besitzt Google eine ganze Menge Informationen über seine Nutzer, sodass die Suchmaschine Annahmen machen kann, nach was eine Person sucht. Deswegen sehen Suchergebnisse, bei identischen Suchbegriffen, nicht immer gleich aus.Diese Unterschiede zu verstehen ist nur der erste winzige Schritt in die Richtung intelligente Mensch-Maschine-Kommunikation. Die manchmal witzigen und verschrobenen Antworten von Siri zeigen, wie weit der Weg noch ist, bis eine künstliche Intelligenz wirklich versteht, was wir meinen. Zudem sind die Antworten im Moment mehr oder weniger stark formalisiert und vorgegeben. Siri kann also nicht wirklich aus einem Wortschatz auswählen und Sätze bilden. Oder neue Worte dazulernen, auch wenn wir versuchen würden, ihr die Worte zu erklären.“Mit dem #SemanticWeb beginnt die Technik uns Menschen zu verstehen, wenn wir sprechen. #BigData“ Twittern WhatsAppDie Chance aber besteht, dass ein Computer sich selbständig die Bedeutung von Worten erschließt. Dazu ist es “nur” nötig, eine genügen große Menge von Texten nach dem entsprechenden Wort und seiner jeweiligen Verwendung zu analysieren. Denn die Semantik, also die Bedeutung der Worte, entstehen aus ihrer Verwendung. Der Satz “Ich gehe Golf spielen” kann nur auf eine Sportart verweisen. Das heißt, wenn das Wort “Golf” im Zusammenhang mit dem Wort “spielen” auftaucht, ist die Sportart Golf gemeint. Manchmal ist es aber nicht so eindeutig. Nur der Satz “Ich gehe zum Golf” genügt beispielsweise nicht aus, um eindeutig zu identifizieren, was gemeint ist. In solchen Fällen sind mehr Informationen notwendig. Um so komplexe Zusammenhänge zu analysieren sind enorme Datenmengen in Echtzeit auszuwerten.Was steht in den Sätzen davor und danach?Wer sagt den Satz?In welcher Situation fällt der Satz? etc.Semantic Web: Das Web 3.0 wird uns verstehenDank Big Data wird das Semantic Web, auch Web 3.0 genannt, die Fähigkeit erwerben, uns zu verstehen. Dank vieler Informationen, die zu jeder Zeit verfügbar sind und einbezogen werden können. Ein Smartphone beispielsweise weiß, ob sich sein Besitzer gerade zuhause aufhält, im Urlaub ist, auf dem Weg zu einem Termin ist, welche Uhrzeit gerade ist etc.Solche Umgebungsvariablen helfen, um bestimmte Bedeutungen auszuschließen oder wahrscheinlich zu machen. Den Status quo dessen, was derzeit möglich ist, stellte das Computerprogramm Watson unter Beweis, als es in der Fernsehsendung Jeopardy gegen die menschlichen Herausforderer gewann. Dazu wertete er eine Textdatenbank mit 100 Gigabyte in Echtzeit aus. Allerdings nutzte er dazu nicht nur einen einzigen intelligenten Algorithmus, sondern eine große Menge von verschiedener Algorithmen, die alle gleichzeitig dieselbe Aufgabe bearbeiteten.“Mit #BigData wird aus dem Web 2.0 das #Web 3.0 – auch #SemanticWeb genannt.“ Twittern WhatsAppJe mehr Algorithmen auf das gleiche Ergebnis kamen, desto wahrscheinlicher war die Antwort richtig. Das Prinzip des Semantic Web, auf dem auch Watson beruht, hat den Vorteil in größeren Zusammenhängen zu “denken”. Damit Watson zu dieser Leistung fähig war, benötigte er 90 Server und insgesamt 16 Terabyte Ram. Da es nur eine Frage der Rechenleistung ist, um die Bedeutung der Sprache zu verstehen, ist es also nur eine Frage der Zeit, bis das Semantic Web Wirklichkeit wird.;https://bigdatablog.de/2015/08/24/big-data-als-voraussetzung-fuer-das-semantic-web/;BigDataBlog;Christian Schön
23. Aug 15;"     ""The Amazon Development Center in Berlin: An Interview about the Future of Big Data""";A few years ago Amazon has startet to replenish its business with Big Data Services – and for that opened its Amazon Development Center for machine learning in Berlin, where authors of e-books meet engineers and engineers meet startups. Dr. Ralf Herbrich, Director of Machine Learning Science, has answered our questions.Dieses Interview auf Deutsch lesenSince 2013 Amazon Web Services is located in Berlin, offering Big Data Services like Sentiment Analysis using data from Twitter. In which way are the services of the new Amazon Development Centre different?Amazon is constantly innovating on behalf of our customers and the Berlin Development Center is a great example of this. At the Berlin Development Center we are working to develop next-generation technologies for Amazon with a particular focus on the area of machine learning and distributed systems. The Berlin Development Center started in a temporary office in Berlin Charlottenburg from September 2013 until June 2015 when we opened our new Berlin office in Krausenhöfe.Among other teams, the office is home to the Amazon Web Services (AWS) team, the AWS OpsWorks team as well as the Amazon Machine Learning team. Some of the technologies developed by these teams have already been launched and made available for customers, such as Amazon Machine Learning and AWS OpsWorks. All of these technologies enable both Amazon and AWS to deliver new capabilities to our customers, whether that be new features for AWS or internal capabilities that allow us to get packages in the hands of Amazon retail customers quicker.;https://bigdatablog.de/2015/08/23/machine-learning-an-interview-about-the-future-of-big-data/;BigDataBlog;Christian Schön
21. Aug 15;" Retweets,      ""Big-Data-Trend: Telematiktarife in der Versicherungsbranche""";"Die Einführung von sogenannten Telematiktarifen spaltet die Versicherungsbranche in zwei Lager. Während die ersten Krankenkassen die Anschaffung von Smart Watches oder Fintessarmbändern bezuschussen und Tarifvergünstigungen gewähren, lehnen andere Kassen dies strikt ab. Gründe, die gegen Telematik in der Versicherungsbranche sprechen, sind das Solidaritätsprinzip, auf dem die Kassen beruhen und datenschutzrechtliche Bedenken. Viele Kassen können und wollen im Fall von Fitnessbändern nicht kontrollieren, wer sie besitzt oder nutzt. Zudem befürchten sie, dass eine Art Zwei-Klassen-System entsteht, in dem die Kosten ungleich verteilt sind.Pro Telematik: Diese Vorteile können entstehenDiesen Einwänden steht eine ganze Reihe von positiven Effekten gegenüber, die durch die Telematik erreicht werden können. Die nachgewiesene Auswirkungen von E-Health auf die Gesundheit ist dabei der Aspekt, auf dem sie beruhen. Weniger Arztkosten, weniger Kosten für Medikamente, weniger Krankheitsausfälle führen zu weniger Kosten für die Versicherungspolicen. Darüber hinaus profitiert die medizinische Forschung von den Daten der Fitnsesstracker, Smartphones und Smart Watches.Telematiktarife bei AutoversicherungenDie Versicherungen Allianz, HUK Coburg, VHV und Itzehoer Versicherung sind die ersten Anbieter auf dem Versicherungsmarkt, die ankündigten, Telematiktarife einzuführen. Die Allianz kann bereits auf eine erfolgreiche Umsetzung dieses neuen Modells in Italien blicken. Dort verändert Big Data bereits die Versicherungsbrache: zwei Millionen Italiener ließen Blackboxes in ihre Autos installieren, die nun ihren Fahrstil aufzeichnen. Wer sich an die Straßenverkehrsordnung hält, profitiert von Vergünstigungen.“Wer eine #Blackbox installiert, kann von neuen #Telematiktarifen einiger Versicherer profitieren.“ Twittern WhatsAppDie Anzahl der Sensoren in Autos und das Datenaufkommen ist enorm hoch, so dass an der Sammlung und (Echtzeit-)Auswertung nicht nur die Versicherungen interessiert sind.Perspektiven: Telematik in anderen BranchenNeben der Versicherungsbranche verspricht sich vor allem die Automobilindustrie viel von dem Einsatz von Telematik-Systemen. Die drei großen Autohersteller Audi, BMW und Mercedes schmiedeten eine Allianz, um gegen die Internetgiganten Google und Apple anzukommen. Gemeinsam kauften sie den Kartendienst Nokia Here, den sie als Joint Venture weiterentwickeln. Das Ziel der Allianz ist es, umfassendes 3-D-Kartenmaterial zu sammeln und in Zukunft für das automatisierte Fahren zu nutzen.Hierzu sind äußerst präzise Karten notwendig, die nicht mit der heute zulässigen Toleranz von bis zu 2 Metern arbeiten können. Bei der Erstellung der Karten ist es nötig 700.000 Messpunkte pro Sekunde zu erfassen. Der Weg zu einem so detaillierten Kartenmaterial geht über telematische Systeme in herkömmlichen Fahrzeugen. Autos werden zukünftig dauerhaft zu fahrenden Messsystemen werden. Dies ist notwendig, um in Echtzeit das Kartenmaterial für Navigationssysteme und selbstfahrende Autos auf dem aktuellen Stand zu halten. Dadurch kann die genaue Position von Baustellen, Pannenfahrzeugen oder anderen Gegenständen erfasst und weitergegeben werden.“#Krankenkassen unterstützen #Smartwatches &amp; Co: So verändert die #Telematik die Versicherungsbranche.“ Twittern WhatsAppVon Vorteilen wie diesen werden immer mehr Branchen ihren Nutzen haben. Den Automobilherstellern werden die Logistikunternehmen und Reiseunternehmen folgen. Bei der Bewertung der Möglichkeiten durch die neuen Technologien, wird entscheidend sein, wie sie eingesetzt werden. Die Versicherungsbranche ist die erste, die unter Beweis stellen kann, dass der Nutzen von Big Data nicht auf Kosten der Allgemeinheit geht.";https://bigdatablog.de/2015/08/21/big-data-trend-telematiktarife-in-der-versicherungsbranche/;BigDataBlog;Ibrahim Evsan
