Datum;Titel;Text;Link;Quelle;Autor
10. Dez 14;" Retweets,      ""Big Data &amp; das Internet der Dinge zwingen Unternehmen zum Umdenken""";"Big Data funktioniert in gewisser Weise wie eine Taschenlampe. Sie bringt Licht dorthin, wo bislang keines war. Durch dieses Licht werden Zusammenhänge in einem bisher nicht denkbaren Maßstab beleuchtet und damit erst erkennbar gemacht. Der digitale Wandel, durch den dieses neue Wissen ermöglicht wird, hat eine viel stärkere und intelligentere Vernetzung zur Folge. Miteinander vernetzt werden jedoch nicht mehr nur Menschen oder Unternehmen. Die Vernetzung, von der hier die Rede ist, betrifft nahezu alles. Jetzt wird uns klar: diese Entwicklung erfordert von uns ein neues Denken. Intelligente und vernetzte Produkte bringen ihren Nutzern nicht nur neue Funktionalität, sondern sie verschaffen dem Produzenten einen Überblick über den gesamten Wertschöpfungsprozess. Durch die aus Big Data gewonnenen Erkenntnisse und durch die Möglichkeiten, die aus der Vernetzung der Welt entstehen, lassen sich Produkte und Prozesse analysieren und automatisieren, überwachen, steuern und optimieren. Das alles und noch viel mehr ist möglich, wenn wir offen sind diese Themen verstehen und nutzen zu wollen.Die neue Übersicht mit Big DataBig Data entsteht überall dort, wo eine Vielzahl von neuen Technologien intelligent miteinander verschaltet wird: Schnelle Rechenleistung von Prozessoren, enorme Speicherkapazitäten von Daten, Cloudtechnologien, smarte Software und Sensoren, die über das Internet mit unzähligen Quellen, Menschen und Datenarchiven verbunden sind. Die Daten, die bei diesem Zusammenspiel entstehen, können Geschichten erzählen. Wenn es gelingt, ihnen diese Geschichten zu entlocken und die richtigen Schlüsse daraus zu ziehen, kann die Welt intelligenter und ein Stück besser werden. Ein Überflug über den Atlantik betrachtet aus Datenperspektive, kann zu enormen Einsparungen führen und damit gleichzeitig zum Klimaschutz beitragen. Dazu werden die Daten aus den Flugzeugturbinen, mit den Daten aus den Sensoren, die den Luftdruck und die Temperaturen messen, historischen Daten aus den Wetterdatenbanken und Angaben zu der Anzahl der Passagiere und der Fracht miteinander in Beziehung gesetzt, Muster analysiert und ausgewertet. Die Daten aus den Flugzeugturbinen erhöhen ganz nebenbei die Sicherheit und minimieren das Risiko eines Ausfalls, da Störungen frühzeitig erkannt und behoben werden können. Auf ähnliche Weise können wir Daten von fast allem erheben und mit diesen Daten völlig neuen Einsichten gewinnen.Das Internet of EverythingIn den 90er Jahre wurde das Internet zu einem Massenmedium und stellte die Unternehmen vor die Herausforderung mit den Menschen, die sich im Netz oder in Social Media bewegten, in Kontakt zu treten. Der Wettbewerbsvorteil resultierte aus einem gekonnten Auftritt im Web oder der gelungenen Erweiterung der Kommunikationskanäle zwischen Firmen und Kunden. In Zukunft werden Wettbewerbsvorteile dadurch zu erreichen sein, wenn Unternehmen das Internet der Dinge zu nutzen wissen. Der Maßstab dieser Herausforderung ist im Vergleich zu früheren Aufgaben ungleich größer. Cisco spricht dabei vom Internet of Everything und hat errechnet, dass heute gerade einmal 10 Milliarden Dinge mit dem Internet verbunden sind. In den nächsten Jahren warten jedoch 1,5 Billionen Objekte darauf, ebenfalls mit Sensoren ausgestattet und vernetzt zu werden. Das daraus resultierende Wachstumspotential beziffert Cisco auf 14,4 Billionen US-Dollar. Um bei diesem Wettbewerb konkurrieren zu können, ist es nötig in den Bereichen Forschung und Entwicklung, der Konzeption und Herstellung von Produkten, im Vertrieb und den IT-Infrastruktur, bis hin zum Ausbau der After-Sales-Services neu zu denken und zu investieren.Algorithmen und ihre Einbettung in komplexe SystemeAuf der ersten Ebene betrachtet, fügen Sensoren den Produkten neue Funktionen hinzu. Der Regensensor unter der Windschutzscheibe eines Autos kann feststellen, ob es gerade regnet beziehungsweise wie stark es regnet und entsprechend kann der Scheibenwischer angeschaltet und die Frequenz reguliert werden. In dieser einfachen Beschreibung liegt das kausale Grundprinzip von allen Algorithmen vor, mit denen Sensoren und Rechner operieren. Ein Algorithmus beruht immer auf dem Schema „Wenn … dann…“: Wenn es regnet, dann den Scheibenwischer anschalten. Wenn es stärker regnet, dann schneller wischen. Wenn die Umgebung dunkel ist, dann das Licht anschalten. Algorithmen können aber auch sehr komplex werden und weiter entfernte Dinge miteinander in Beziehung setzen. Wenn die eingebauten Sensoren mit einer Cloud kommunizieren oder über das Netz mit anderen Systemen verbunden ist, kann ein Auto auf Gegebenheiten reagieren oder Vorschläge machen, die den „Sensoren“ des Fahrers, also seinen Sinnen, entgehen oder außerhalb ihrer Reichweite liegen. Wenn ein Auto mit einem intelligenten Verkehrsleitsystem verbunden ist, können Staus umfahren oder sogar vermieden werden. Schlaglöcher in der Straße können direkt an die Stadtverwaltung gemeldet werden, während umgekehrt der Fahrer in der Innenstadt auf freie Parkplätze hingewiesen werden kann. Und das beste ist, wir hätten ganz neue Art von Wetterdaten. Ein intelligentes Auto ist nicht länger nur ein intelligentes Auto, sondern Teil von viel komplexeren Systemen.Wie sollen Wertschöpfung und Werterschließung funktionieren?Die Sensoren und die aus ihnen gewonnenen Informationen fördern wertvolles Wissen über den tatsächlichen Gebrauch, über Prozesse und die Gewohnheiten der Kunden zutage. Diese Erkenntnisse können zurückfließen in die Entwicklungsabteilungen und dort bei der Erweiterung und der Neukonzeption von Produkten helfen. Features, die in der Produktion teuer sind und in der Praxis vielleicht gar nicht gebraucht werden, können eingespart werden. Beim Herstellungsprozess helfen die Sensoren und die Daten bei der Überwachung von Produktionsketten, registrieren Störungen und unterstützen dabei, Abläufe zu optimieren.Aus der Digitalisierung beziehungsweise aus dem Prozess der Erzeugung und Analyse von Big Data leiten sich neue Geschäftsmodelle ab. Denn mit den neuen Daten und den großen Datenmengen erwachsen selbst neue Aufgaben, die zum Teil erst noch erschlossen werden müssen und volkswirtschaftlich ein enormes Potential darstellen. Die Erhebung, die Verarbeitung und Weiterverwertung von Daten und nicht zu vergessen der Schutz von Daten sind unternehmerische Felder, auf denen noch viel brach liegt.Kooperation in einer vernetzten WeltProdukte und Prozesse können in Zukunft nicht mehr isoliert betrachtet werden, sondern werden immer als ein Teil eines Systems wahrgenommen. Ein System wiederum ist eingebettet in andere Systeme, mit denen es interagieren kann. Neue Geschäftsfelder entstehen an den Schnittstellen von neuen und traditionellen unternehmerischen Aufgaben. Das Internet der Dinge, Big Data und die Smart Industry sind die Technologien, mit denen sich die Energiewende gestalten lässt. Eine Waschmaschine, die Teil eines Smart Homes ist, kann sich genau dann einschalten, wenn sie von der Windkraftanlage, die mit Smart-Grid-Technologie ausgestattet ist, die Information erhält, dass gerade Energie erzeugt wird und damit günstiger, regional produzierter Ökostrom genutzt werden kann.Ganze Branchen werden sich, aufgrund der Vernetzung der Dinge, verändern. Unternehmen, die ihre Wettbewerbsfähigkeit erhalten wollen, müssen sich auf die Folgen, die daraus entstehen, einstellen. Aus den neuen Kooperationsmöglichkeiten werden alle Beteiligten profitieren. Produktionsanlagen, die mit Sensoren zur Überwachung ausgestattet sind, können über eine Cloud, in der Daten über den normalen Betrieb gespeichert sind, permanent abklären, ob alles in Ordnung ist. Wenn ein Fehler oder auch nur von der Norm abweichende Daten gemessen werden, kann die Maschine direkt über das Internet eine Meldung an den Hersteller senden, die Art des Fehlers mitteilen und sogar präventiv Maßnahmen einleiten. Der Hersteller wiederum hat die Möglichkeit den Fehler über ein Update zu beheben oder einen Mitarbeiter, der die Diagnose schon erhalten hat, mit dem richtigen Ersatzteil los schicken, ohne dass es zu einem Produktionsausfall kommt. Dadurch werden die Reparaturkosten minimiert und Ausfälle verhindert.Unternehmen müssen aufgrund von Big Data umdenken“#BigData &amp; das #Internet der Dinge zwingen #Unternehmen zum Umdenken.“ Twittern WhatsAppDurch Big Data, Sensortechnik und Vernetzung werden Produkte auf dem Markt intelligenter und im Vergleich zu vorherigen Produkten attraktiver. Da sie mit dem Hersteller, den Zulieferern, den Kunden und anderen Systemen verbunden sind, wird eine bislang nicht gekannte Interaktivität ermöglicht, aus der Nutzen und Vorteile entstehen. Durch diese Intelligenz der Produkte werden alle herkömmlichen Grenzen gesprengt und ganze Branchen revolutioniert. Die Auswirkungen auf die gesamte Volkswirtschaft werden enorm sein. Doch auch die Wertschöpfungsketten werden durch die neuen Technologien berechenbarer. Die Sensoren überwachen den Betrieb und im Abgleich mit Datenbanken helfen sie bei der Steuerung und Optimierung der Produktion. Die Veränderungen in all diesen Bereichen zwingen Unternehmen zum überdenken und nachdenken: Wie verändert sich meine Stellung am Markt? Ist mein Geschäftsmodell noch marktkonform und konkurrenzfähig? Welche neuen Aufgaben kommen durch die Veränderungen hinzu? Welche Vorteile und Nutzen erwächst aus den neuen Möglichkeiten?Unternehmen werden sich diesen Fragen stellen müssen, um ihre Stellung am Markt zu erhalten oder zu verbessern. Durch die Neuerungen werden nicht nur die Produkte immer intelligenter, die Produktions- und Distributionsprozesse sicherer und optimiert – von den Neuerungen durch den digitalen Wandel wird die gesamte Volkswirtschaft und damit alle Mitglieder der Gesellschaft profitieren.";https://bigdatablog.de/2014/12/10/big-data-das-internet-der-dinge-zwingen-unternehmen-zum-umdenken/;BigDataBlog;Ibrahim Evsan
02. Dez 14;" Retweets,      ""Big Data – Google is watching you""";Google is watching you. Datenschützer, Politiker und User fordern bereits seit geraumer Zeit mehr Transparenz vom Internetgiganten Google. Schließlich werden zahlreiche Dienste des Unternehmens von uns genutzt – was dabei mit unseren Daten passiert, ist oftmals nicht nachvollziehbar. Mit dem 2009 eingerichteten Dashboard kam Google uns zumindest ein wenig entgegen, denn plötzlich konnten User gesammelte Informationen einsehen und über entsprechende Links Einstellungen vornehmen. Ein Blick in die Privatsphäreeinstellungen kann daher sehr hilfreich sein.Zudem können unter Datentools beispielsweise gespeicherte Lesezeichen und Nachrichten archiviert und heruntergeladen werden.Der Online-Speicherdienst Cloud Defender hat zudem sechs hilfreiche Links zusammengestellt, um im Datendschungel einen Überblick zu behalten.1. Personenprofil bei GoogleUm personalisierte Werbung schalten zu können, sammelt Google Daten wie Geschlecht, Alter, Sprachen, Interessen, aber auch blockierte Kampagnen von Werbetreibenden. Was Google bereits über dich gespeichert hat, kannst du hier überprüfen.2. Suchanfragen auf google.deJede einzelne Suchanfrage wird von Google in der History gespeichert. Wer das nicht möchte, kann die Suchergebnisse kurzfristig stoppen, einzelne lassen sich gar löschen. Wird auf eine Werbeanzeige geklickt, weiß Google auch das.3. StandortGoogle Now (Android-Version) verbindet nicht nur einzelne Dienste wie Maps und Mail miteinander, sondern zeichnet auch Geodaten auf. Diese können aber hier eingesehen und gelöscht werden.4. IP-Adresse, Gerätenutzung und Standort des GerätsAuch diese Informationen greift Google ab. Herauszufinden sind die Daten hier.5. Apps und Erweiterungen, die auf Google-Daten zugreifenApps die Zugang zu Google-Diensten haben, werden unter folgender Adresse gelistet, können aber auch abgeschaltet werden.6. YouTube-SuchanfragenÄhnlich wie bereits auf google.de wird auf youtube.com jede einzelne Suchanfrage gespeichert. Wer also nicht mehr weiß, nach welchen Videos er gesucht hat, dem hilft dieser Link.;https://bigdatablog.de/2014/12/02/big-data-google-is-watching-you/;BigDataBlog;Ibrahim Evsan
20. Okt 14;" Retweets,      ""Beacons. Signalsender für das Internet der Dinge:  Irrlichter oder Leuchtturm?""";"Die Beacon-Technologie (von Signal, Licht) ermöglicht einem den Traum von „sprechenden Gegenständen“ á la Disney. Per App lassen sich Besucherströme in Stadien lenken, komplizierte Wege zum Flughafen-Gate zeigen und freie Tische im Restaurant finden – und direkt die Bestellung erledigen. Was zunehmend zum Ortsleit- und Auskunftssystem ausgebaut werden soll, steckt noch fest im Gerangel um die richtigen Industriestandards. Das Signal der stationären, münzgroßen Beacons kann von Bluetooth-Empfängern in der Umgebung abgetastet werden. Dank einer Minibatterie arbeiten sie für über ein Jahr autark. Das Internet der Dinge vernetzt sich für den persönlichen mobilen Service – überall im öffentlichen Raum. Der Kellner erfährt Live, wo er gebraucht wird und der Besucher im Freizeitpark, wo die Achterbahn mit der geringsten Wartezeit zu finden ist. Stets im Hinterkopf der Betreiber sind dabei ein Mehr an Informationen und Effizienz. Also Kostensenkung. Und die Möglichkeit, in Echtzeit (kommerzielle) Angebote zu machen.Wenn einem das Werbeplakat individuelle Empfehlungen ausspricht.Via Beacons und App gelangt man direkt zu einem Verkaufspunkt – wo man dieselbe Schnittstelle gleich zum Bezahlen benutzt. Apple Stores sind weltweit mit der Technologie (ibeacon) ausgestattet, Disney kooperiert und McDonalds zieht nach.“Wo ist meine Stadionbox? Wo ist mein Kellner? #Beacons erleichtern das Leben – und die Werbung“ Twittern WhatsAppZur Überwachung von Passanten, wie im Fall von Titan, eignet sich das System nur bedingt. Die günstigen Sender sammeln selber keine Informationen. Aber die SmartPhone-Apps können auch auch unauffällig als Trojaner installiert werden oder als Teil von größeren Diensten wie Facebook und Google Maps. Wie diese Daten in der Cloud dann verarbeitet werden – und welche überhaupt erfasst werden, ist unklar. Die Überwachungs- und Nutzungsabsichten von Staat und Unternehmen sind jedoch ernst zunehmen. Jüngst wurde ein pakistanisches Unternehmen in den USA dafür verurteilt, Spionage-Apps frei verkauft zu haben. Die Hoffnungen der Unternehmen konzentrieren sich jedoch auf die freiwillige Nutzung der Apps. Angebote sollen nur auf die Handys gepusht werden, wenn dies gewünscht ist. Der Kunde soll die Wahl bekommen, ob er im Restaurant lieber per Smartphone bestellt oder der Kellner geholt werden soll.Interaction on demand – oder doch nur Werbung?Zielgenaue Kommunikation zwischen Mensch und Umwelt (Maschine) verringert den Suchaufwand – und für diesen Nutzen haben wir bereits weitreichende Einschränkungen unserer Freiheit akzeptiert. WLAN-Netzwerke haben ähnliche Funktion wie Beacons und werden schon heute für die Standortbestimmung genutzt – ungefragt, unkontrolliert. Alternative Technologien versuchen bei geringeren Kosten den Funktionsumfang auszuweiten. Die mit Bluetooth verbundenen Beacon-Apps verbrauchen knappe Smartphone-Energie. Zwar weniger, als die aktuelle NFC-Technologie, aber dennoch. Neue Standards auf LTE-Basis haben das Potenzial, noch viel mehr herauszuholen. So ist der Ping, das Signal, bei LTE nicht nur in einem Umkreis von bis zu 15 Metern (Bluetooth) oder 80 Zentimetern (NFC) empfangbar, sondern im Umkreis von bis zu 500 Metern. Und das bei geringerem Energieaufwand bei Sender und Empfänger. Das letzte Signal ist also noch lange nicht gesendet, wenn es darum geht, auch die materielle Welt zu vernetzen.// <!CDATAjQuery('#slideshare_embed_31116426').click(function() {    if(confirm('Sie sind dabei eine SlideShare Präsentation zu öffnen. SlideShare nutzt Tracking-Technologien, die Ihre IP Adresse an Dritte weitergibt. Wir als Seitenbetreiber haben auf die Tracking-Methoden des externen Anbieters leider keinen Einfluss. Sollten Sie damit nicht einverstanden sein, wählen Sie bitte abbrechen!')){        jQuery('.wp-image-2894').remove();        jQuery('#slideshare_embed_31116426').append('');    }else{        alert('Die SlideShare Präsentation finden Sie unter http://www.slideshare.net/slideshow/embed_code/31116426');    }});// &gt;";https://bigdatablog.de/2014/10/20/beacons-signalsender-fuer-das-internet-der-dinge-irrlichter-oder-leuchtturm/;BigDataBlog;Tobias Hauck
14. Okt 14;" Retweets,      ""Beacons auf dem Vormarsch – über ihre Verwendung wird gestritten""";Die New Yorker Stadtverwaltung hat den Plakatierer Titan dazu aufgefordert, sein innerstädtisches System an „Beacons“ abzubauen. Trotzdem sich der Anbieter von Werbeflächen auf Telefonzellen vor der Installation der kleinen Signalsender von einem städtischen Amt eine Genehmigung einholte, sei dieser Schritt nun nötig, so Phil Walzak, Sprecher der Stadtveraltung.  “Die #Beacons sind unter uns – in New York werden die ersten Sender aus Datenschutzgründen wieder abgebaut.“ Twittern WhatsApp Mithilfe der App iBeacon Detector war von dem Medienportal BuzzFeed herausgefunden worden, dass rund 20 von über 500 Beacons in der Nähe des Times Square verbaut wurden. Dies sei Laut Titan zu Wartungszwecken geschehen. Darüber hinaus können die kleinen Sender der Firma Gimbal dazu genutzt werden, Bewegungsprofile von Menschen in ihrer Umgebung zu erstellen – ohne deren Wissen. Da es keinen öffentlichen Entscheid und Informationen über die Anwendung der Technologie gab, rückt sie in die Grauzone des Rechtmäßigen und wird nun vom Betreiber abgebaut.Ein Porträt der Technologie und der neuesten Entwicklungen gibt es an dieser Stelle in den nächsten Tagen. Zu den in New York verwendeten Beacons gibt es ein Info-Video:;https://bigdatablog.de/2014/10/14/beacons-auf-dem-vormarsch-ueber-ihre-verwendung-wird-gestritten/;BigDataBlog;Tobias Hauck
10. Okt 14;" Retweets,      ""E-Health – ein Drama in fünf Akten""";PrologE-Health, das sind (Big Data-)Technologien im und um den menschlichen Körper herum. Implantiert, als Uhr getragen, im Gürtel, der Kontaktlinse, als Brille, Schuheinlage oder eingenäht in die Kleidung. Bald wird jede Regung des menschlichen Körpers verfolgt werden können. Ständig.Erster AktDer Patient betritt die Klinik. Zum ersten Mal in dieser Stadt. Am Empfang liegen alle Daten bereits vor, in der Sprechstunde hat der Arzt Zugriff auf die gesamte relevante Krankengeschichte und im angeschlossenen Diagnosezentrum wird automatisiert der Check-up sämtlicher auf dieser Krankengeschichte beruhenden und altersbedingten Risiken überprüft. Automatisiert bis hin zur Ergebnisanalyse. Erst bei der Therapie wird der Arzt zu Rate gezogen. Das ist effektiv, schnell, angenehm, billig – und ziemlich transparent. Gegenüber vielen Menschen.Ist das eine praktische Hilfe oder dreiste Kontrolle?Fest steht, es macht vieles einfacher. Zweiter AktAuffällige Werte, seltsame Symptome: Der Patient hat den Jackpot geknackt. Eine komplizierte und seltene Krankheit hat sich breit gemacht. Man braucht mehr Informationen – und den direkten Vergleich zu anderen Fällen, seien es noch so wenige. Kabellose biometrische Sensoren werden heute so billig, genau und vertraut, dass sie bald unsere ständigen Begleiter werden. Von der einfachen Gewichtserfassung zu bis zu hochempfindlichen EKG. Die Kombination dieser Daten und der Abgleich digitaler Krankenakten mit anderen Patienten macht Muster sichtbar. Immer gleiche Zusammenhänge. Und den Erfolg von Therapien. Diagnosen werden genauer und Studien schneller.Aber: Um diese Datenmassen in brauchbare Informationen zu verwandeln braucht es einen regen Informationsaustausch und zentrale Auswertungseinheiten. Deswegen steht schon heute am Anfang die Unterschrift des Patienten, seine Zustimmung zur Datennutzung. Bist Du bereit, Deinen Körper transparent zu machen und Erkenntnisse mit einem anonymen System zu teilen?Dritter AktEs kommt immer schlimmer, als man denkt. Die Krankheit ist kein Einzelfall. Denn sie ist hoch ansteckend. Gott sei Dank wissen die E-Health-Nerds damit umzugehen und schützen die Gesellschaft.Es grenzt an Magie.Die verborgenen Aufzeichnungen der digitalisierten Welt sagen uns schon heute Entscheidendes über Gegenwart und Zukunft. Die richtigen, schlau gewichteten Daten geben eine Masse, die einmal durch das Analysefilter gequetscht, am Ende eine Essenz von Wahrheit und Rettung tröpfeln lässt. Nicht nur Staus und Erdbeben wird mit solchen Methoden der Kampf angesagt. Google Flu Trends steht zwar aktuell wegen seiner Unzuverlässigkeit in der Kritik, was aber nichts an der prinzipiellen Chance ändert: Epidemien frühzeitig erkennen oder gar vorhersagen. Google verlässt sich dabei auf Veränderungen im Suchverhalten der Nutzer und hat 45 Schlüsselbegriffe identifiziert, die eng mit dem Grippeaufkommen verbunden sind. Die Live-Erfassung von Daten aus Diagnosezentren, Apotheken oder Wearables wird das Verfahren in Zukunft verfeinern.Vierter AktAbgleich von Live-Daten für neue Erkenntnisse und Therapien – es ist keine Binsenweisheit. Manchmal muss man nur genauer hinschauen, denn:Das Glück liegt immer vor der Nase. Intelligente Schuhsohlen entdecken Geschwüre von Diabetikern schon Tage vor der Ausbildung. 95 Prozent zuverlässig ist diese Fußbetreuung und kann in der Forschung neue Erkenntnisse bringen. Computer, die bald vollständig den Körper auf Nervenbasis simulieren können, bilden das Gegenstück zum digital verbesserten Menschen. Aufwendige, randomisierte und doppelblinde Studien, geringe Aussagekraft aufgrund zu vieler Einflussfaktoren und langwieriges Datensammeln werden zwar keine Ende haben – aber, so die Hoffnungen, weniger entscheidend sein.“#E-Health und #BigData sorgen zusammen für eine einfachere, schnellere, gesündere Welt. http://bigdatablog.de/?p=778 “ Twittern WhatsAppFünfter AktDu bist gezwungen, Deine Gesundheit zu optimieren – und doch wird jemand anderes stets die besseren Möglichkeiten dazu haben. Gesundheitssysteme sind nicht gerecht. Du. Bist. Allein. Wenn die Sohle einem sagt, dass der Fuß sich in ein Geschwür verwandelt, die App, wann etwas einzunehmen ist und der Videochat Ärzte und Hilfegruppen ersetzt, ist die Gesundheit digitalisiert und Du physisch alleine. Franz-Joseph Bartmann, Präsident der Ärztekammer Schleswig-Holstein, hat das erkannt: Es ist ein biologischer Prozess, das heißt, die nachwachsende Generation wird mit Daten ganz anders umgehen als diejenige, die kurz vor Aufgabe ihrer praktischen Tätigkeit ist“.Neu leben lernen.Ganz neue Kompetenzen werden da gebraucht, um zu unterscheiden, wann die Technik mir helfen soll und wann ich mir einen Menschen als Ansprechpartner leisten will. Wachstum der Lebenserwartung und Gesundheit darf kein Selbstzweck sein. Auf die Lebensqualität kommt es an. Denn eines ist klar: E-Health wird das Preisgefüge im Gesundheitssystem umkrempeln. Dass es so sozial bleibt, wie es heute ist, muss erneut erkämpft werden.Senkung von gemein-schaftskosten durch       E-Health (in Mrd. $) | Create Infographics;https://bigdatablog.de/2014/10/10/e-health-ein-drama-in-fuenf-akten/;BigDataBlog;Tobias Hauck
